date,category,published_date,site_name,url,title,summary,content,region,score_ag,keywords,reward_x,rl_score,lgbm_score,reward_y,final_score,strategic_score,lgbm_component,is_top20
2026-03-27,Client,2026-03-27 13:18:00,Naver News,https://www.hankyung.com/article/2026032689466,"""K바이오, 빅파마 '특허절벽' 기회""…대박 기업 찾는 법은? [인터뷰+]","""K바이오, 빅파마 '특허절벽' 기회""…대박 기업 찾는 법은? [인터뷰+], TIGER 기술이전바이오액티브 ETF 운용하는 송재원 매니저 상장 후 8일간 비교지수 대비 11%P 초과수익 ""글로벌 매출 1위 의약품 키트루다 특허 2028년 만료"" ""韓바이오 역량 크게 향상…기술이전 경험 축적 덕분"" ""글로벌 투자 컨퍼런스 및 학회서 신약 개발 트렌드 탐색"" ""누적 기술이전 계약 규모와 시가총액 비교해 분석해야"".","""K바이오, 빅파마 '특허절벽' 기회""…대박 기업 찾는 법은? [인터뷰+], TIGER 기술이전바이오액티브 ETF 운용하는 송재원 매니저 상장 후 8일간 비교지수 대비 11%P 초과수익 ""글로벌 매출 1위 의약품 키트루다 특허 2028년 만료"" ""韓바이오 역량 크게 향상&hellip;기술이전 경험 축적 덕분"" ""글로벌 투자 컨퍼런스 및 학회서 신약 개발 트렌드 탐색"" ""누적 기술이전 계약 규모와 시가총액 비교해 분석해야""",local,10,화이자,,,0,,11.600000000000001,14.0,10,True
2026-03-27,Client,2026-03-25 19:55:00,Naver News,https://news.bizwatch.co.kr/article/healthcare/2026/03/25/0041,"알테오젠, 이번엔 바이오젠…8670억 규모 플랫폼 수출","알테오젠이 MSD, 다이이찌산쿄 등에 이어 글로벌 빅파마인 바이오젠(Biogen)을 새로운 파트너로 맞이하며 인간 히알루로니다제 플랫폼 'ALT-B4'의 확장성을 다시 한번 증명했다.","알테오젠이 MSD, 다이이찌산쿄 등에 이어 글로벌 빅파마인 바이오젠(Biogen)을 새로운 파트너로 맞이하며 인간 히알루로니다제 플랫폼 &#39;ALT-B4&#39;의 확장성을 다시 한번 증명했다.    알테오...",local,10,바이오젠,,,0,,11.600000000000001,14.0,10,True
2026-03-27,Client,2026-03-26 22:10:00,Naver News,http://www.econonews.co.kr/news/articleView.html?idxno=432864,"식품의약품안전처, '식품부당행위긴급대응단' 출범...""AI 가짜의사 약·식품광고 근절""","식품의약품안전처는 지난 24일 온라인을 중심으로 증가하는 식품 부당광고 및 소비자 기만행위의 신속하고 체계적인 대응을 위해 '식품부당행위긴급대응단'을 공식 출범했다고 25일 밝혔다.식약처에 따르면 최근 온라인을 중심으로 먹는 위고비·마운자로 등과 같은 의약품 명칭을 모방한 식품 광고와 인공지능(AI)을 활용한 가짜 전문가 추천 광고 등이 증가하고 있다. 이에 따라, 소비자 피해를 예방하고 건전한 유통질서를 확립하기 위한 통합 대응체계 마련의 필요성이 커지고 있다.식약처는 가짜·조작·왜곡 정보, 부당광고 등.","[이코노뉴스=이종수 기자] 식품의약품안전처는 지난 24일 온라인을 중심으로 증가하는 식품 부당광고 및 소비자 기만행위의 신속하고 체계적인 대응을 위해 '식품부당행위긴급대응단'을 공식 출범했다고 25일 밝혔다.식약처에 따르면 최근 온라인을 중심으로 먹는 위고비·마운자로 등과 같은 의약품 명칭을 모방한 식품 광고와 인공지능(AI)을 활용한 가짜 전문가 추천 광고 등이 증가하고 있다. 이에 따라, 소비자 피해를 예방하고 건전한 유통질서를 확립하기 위한 통합 대응체계 마련의 필요성이 커지고 있다.식약처는 가짜·조작·왜곡 정보, 부당광고 등",local,10,마운자로,,,0,,11.600000000000001,14.0,10,True
2026-03-27,BD,2026-03-27 16:08:00,Naver News,http://www.whosaeng.com/169268,≪후생신보≫ 베링거인겔하임 매출 7.3% 성장...혁신 신약 2건 출시 주효,베링거인겔하임의 2025년 매출이 전년 대비 7.3% 성장했다. 2건의 혁신 신약 출시가 주효했다는 평가다. 베링거인겔하임이 인체의약품.,【후생신보】 베링거인겔하임의 2025년 매출이 전년 대비 7.3% 성장했다. 2건의 혁신 신약 출시가 주효했다는 평가다.   베링거인겔하임이 인체의약품,local,10,백신,,,0,,11.600000000000001,14.0,10,True
2026-03-27,BD,2026-03-27 17:24:00,Naver News,https://www.ajunews.com/view/20260327140557981,"제약사들, 코프로모션으로 영업력 결합…포트폴리오 확장 나서 | 아주경제",오리지널 의약품을 보유한 다국적제약사와 국내 영업망을 갖춘 제약사 간 코프로모션(공동판매)이 이어지고 있다.각 사의 강점을 결합해 시장 안착 속도와 매출을 끌어올...,오리지널 의약품을 보유한 다국적제약사와 국내 영업망을 갖춘 제약사 간 코프로모션(공동판매)이 이어지고 있다.각 사의 강점을 결합해 시장 안착 속도와 매출을 끌어올...,local,10,공동판매,,,0,,11.2,13.0,10,True
2026-03-27,Distribution,2026-03-23 06:00:00,Naver News,https://www.bosa.co.kr/news/articleView.html?idxno=3001195,다국적제약사 잇따른 의약품 품절 공문…체계적 관리 필요 - 의학신문,최근 다국적 제약사들이 의약품 유통업체와 의료기관에 품절 관련 공문을 발송하면서 환자 치료에 차질이 우려되고 있다.23일 관련업계.,[의학신문·일간보사=김상일 기자]최근 다국적 제약사들이 의약품 유통업체와 의료기관에 품절 관련 공문을 발송하면서 환자 치료에 차질이 우려되고 있다.23일 관련업계,local,10,오펠라,,,0,,11.2,13.0,10,True
2026-03-27,BD,2026-03-26 14:20:00,Naver News,https://www.pinpointnews.co.kr/news/articleView.html?idxno=440204,사업 다각화 속도전…백신으로 눈 돌린 제약사들,"국내 제약사들이 백신 사업에 속속 뛰어들며 포트폴리오 재편에 나서고 있다. 전문의약품(ETC) 대비 안정적인 수익원을 확보하려는 움직임으로, 다국적 제약사와의 코프로모션 전략이 빠르게 확산되는 추세다.26일 업계에 따르면 휴온스는 최근 사노피와 백신 5종에 대한 국내 유통 및 코프로모션 계약을 체결하고 전담 조직인 백신사업부까지 신설했다. 이로써 독감, A형간염, 수막구균 등 주요 백신을 국내 시장에 공급하기 위한 체계를 갖췄다.","국내 제약사들이 백신 사업에 속속 뛰어들며 포트폴리오 재편에 나서고 있다. 전문의약품(ETC) 대비 안정적인 수익원을 확보하려는 움직임으로, 다국적 제약사와의 코프로모션 전략이 빠르게 확산되는 추세다.26일 업계에 따르면 휴온스는 최근 사노피와 백신 5종에 대한 국내 유통 및 코프로모션 계약을 체결하고 전담 조직인 백신사업부까지 신설했다. 이로써 독감, A형간염, 수막구균 등 주요 백신을 국내 시장에 공급하기 위한 체계를 갖췄다. 주사제 영업력과 콜드체인 유통 경험 등 기존 역량을 기반으로 빠르게 시장에 안착하겠다는 복안이다.광동제",local,10,코프로모션,,,0,,11.2,13.0,10,True
2026-03-27,BD,2026-03-25 22:58:00,Naver News,https://www.ziksir.com/news/articleView.html?idxno=128519,"휴온스, 백신 사업 진출…사노피와 5종 백신 유통 계약 체결","휴온스가 글로벌 바이오제약 기업 사노피의 한국법인(사노피)와 함께 백신 시장에 진출한다.휴온스는 사노피와 백신 주사제 5종에 대한 국내 유통 및 코프로모션(Co-promotion) 계약을 25일 체결했다.휴온스는 오는 4월 1일부터 ▲인플루엔자 백신 ‘박씨그리프(standard-dose)’ 및 ‘에플루엘다(high-dose)’, 성인 대상 접종 영역에서의 ▲디프테리아·파상풍·백일해 백신 ‘아다셀’ ▲A형간염 백신 ‘아박심160’ ▲수막구균 백신 ’멘쿼드피’ 등 총 5종의 백신에 대한 국내 유통 및 프로모션을.","[직썰 / 성유창 기자] 휴온스가 글로벌 바이오제약 기업 사노피의 한국법인(사노피)와 함께 백신 시장에 진출한다.휴온스는 사노피와 백신 주사제 5종에 대한 국내 유통 및 코프로모션(Co-promotion) 계약을 25일 체결했다.휴온스는 오는 4월 1일부터 ▲인플루엔자 백신 ‘박씨그리프(standard-dose)’ 및 ‘에플루엘다(high-dose)’, 성인 대상 접종 영역에서의 ▲디프테리아·파상풍·백일해 백신 ‘아다셀’ ▲A형간염 백신 ‘아박심160’ ▲수막구균 백신 ’멘쿼드피’ 등 총 5종의 백신에 대한 국내 유통 및 프로모션을",local,10,코프로모션,,,0,,11.2,13.0,10,True
2026-03-27,Distribution,2026-03-24 09:32:00,Naver News,http://www.kdfnews.com/news/articleView.html?idxno=180663,이란에 발목 잡힌 K-뷰티·K-바이오...11조 수출 신기록 직격탄 [중동전쟁],"한국 K-뷰티와 K-바이오 기업들이 중동 시장을 다음 성장 거점으로 낙점하고 허가 취득과 유통 파트너 확보를 마친 시점에 중동 전쟁이 터지며 진출 전략 전반에 불확실성이 커지고 있다.국내 보툴리눔 톡신(보톡스) 3사의 중동 공략은 최근 1~2년 사이 가시적인 성과를 냈다. 휴젤은 쿠웨이트에 이어 UAE 허가를 취득하고 두바이 유통사 메디카그룹과 손잡아 걸프 전역으로 보툴락스 공급망을 구축했다. 대웅제약은 사우디아라비아에 보툴리눔 톡신 나보타를 들여간 첫 아시아 기업이 됐고, 메디톡스는 UAE에서 히알루론산 필러 뉴라미스 허가를 받은.","한국 K-뷰티와 K-바이오 기업들이 중동 시장을 다음 성장 거점으로 낙점하고 허가 취득과 유통 파트너 확보를 마친 시점에 중동 전쟁이 터지며 진출 전략 전반에 불확실성이 커지고 있다.국내 보툴리눔 톡신(보톡스) 3사의 중동 공략은 최근 1~2년 사이 가시적인 성과를 냈다. 휴젤은 쿠웨이트에 이어 UAE 허가를 취득하고 두바이 유통사 메디카그룹과 손잡아 걸프 전역으로 보툴락스 공급망을 구축했다. 대웅제약은 사우디아라비아에 보툴리눔 톡신 나보타를 들여간 첫 아시아 기업이 됐고, 메디톡스는 UAE에서 히알루론산 필러 뉴라미스 허가를 받은",local,10,DHL,,,0,,11.2,13.0,10,True
2026-03-27,BD,2026-03-25 22:22:00,Naver News,https://www.hani.co.kr/arti/hanihealth/pharm/1251120.html,"[제약바이오 소식] 휴온스, 사노피와 협력해 백신 시장 진출","휴온스가 글로벌 빅파마 중 한 곳인 사노피와 함께 국내 백신 시장에 진출한다. 25일 휴온스그룹 휴온스는 사노피의 한국법인인 사노피코리아와 백신 주사제 5종에 대한 국내 유통 및 코프로모션(Co-promotion·공동판매) 계약을 체결했다. 이에 따라, 휴온스는 오는.","휴온스가 글로벌 빅파마 중 한 곳인 사노피와 함께 국내 백신 시장에 진출한다. 25일 휴온스그룹 휴온스는 사노피의 한국법인인 사노피코리아와 백신 주사제 5종에 대한 국내 유통 및 코프로모션(Co-promotion·공동판매) 계약을 체결했다. 이에 따라, 휴온스는 오는",local,10,코프로모션,,,0,,11.2,13.0,10,True
2026-03-27,BD,2026-03-26 12:10:00,Naver News,https://www.hitnews.co.kr/news/articleView.html?idxno=74851,"비아그라 등 비아트리스 비뇨기 3품목, 일동제약이 판매",한국메나리니가 3년간 판매한 비아트리스코리아의 비뇨기계 3품목을 일동제약이 판매할 예정이다. 비뇨기계 3품목은 ①비아그라(실데나필) ②카두라XL(독사조신) ③디트루시톨SR(톨터로딘-L-타르타르산염)로 판권 이전 이야기는 수개월째 업계에서 회자됐다.약국가 및 유통업계 등에 따르면 한국메나리니 비뇨기계 3품목을 4월부터 일동제약이 판매한다.해당 3품목 판매계약은 올해 2월 말 종료 예정이었으나 3월 한달 한국메나리니가 더 판매했다.2025년 3품목 유통액은 아이큐비아 기준 대략 124억원이며 일동제약은 비뇨기과 포트폴리오를 확보할 수.,한국메나리니가 3년간 판매한 비아트리스코리아의 비뇨기계 3품목을 일동제약이 판매할 예정이다. 비뇨기계 3품목은 ①비아그라(실데나필) ②카두라XL(독사조신) ③디트루시톨SR(톨터로딘-L-타르타르산염)로 판권 이전 이야기는 수개월째 업계에서 회자됐다.약국가 및 유통업계 등에 따르면 한국메나리니 비뇨기계 3품목을 4월부터 일동제약이 판매한다.해당 3품목 판매계약은 올해 2월 말 종료 예정이었으나 3월 한달 한국메나리니가 더 판매했다.2025년 3품목 유통액은 아이큐비아 기준 대략 124억원이며 일동제약은 비뇨기과 포트폴리오를 확보할 수,local,10,코프로모션,,,0,,11.2,13.0,10,True
2026-03-27,BD,2026-03-25 18:14:00,Naver News,http://www.thevaluenews.co.kr/news/view.php?idx=197664,"[제약·바이오 레이더] 셀트리온·휴온스·삼성바이오, 신사업·수주 ‘...",코프로모션 계약을 체결했다. 삼성바이오로직스는 미국 뉴욕에서 개최된 DCAT Week 2026(이하 디캣)에 참가해... 코프로모션 계약을 체결했다. 휴온스는 다음 달부터 해당 제품의 국내 유통과 마케팅을 담당한다. 대상... ,코프로모션 계약을 체결했다. 삼성바이오로직스는 미국 뉴욕에서 개최된 DCAT Week 2026(이하 디캣)에 참가해... 코프로모션 계약을 체결했다. 휴온스는 다음 달부터 해당 제품의 국내 유통과 마케팅을 담당한다. 대상... ,local,10,코프로모션,,,0,,11.2,13.0,10,True
2026-03-27,BD,2026-03-27 17:58:00,Naver News,http://www.paxetv.com/news/articleView.html?idxno=267184,"로아앤코 그룹 차백신 'M&A 설계자' 의혹 정면 반박…""악의적 추측에 강력 법적 대응""",로아앤코그룹은 최근 불거진 차백신연구소 인수합병(M&A) ‘막후 설계자’ 의혹에 대해 공식 입장을 내고 정면 반박에 나섰다.단순 투자 기회 소개와 일부 재무적 투자자(FI) 참여를 ‘머니게임’으로 치부하는 시장 일각의 시선에 대해 명예훼손에 따른 강력한 법적 조치를 예고했다.로아앤코 측은 최근 보도된 차백신연구소 구주 인수 및 유상증자 과정에서 온성준 회장과 로아앤코가 딜 전반을 기획했다는 주장은 주장은 전혀 사실이 아니라고 밝혔다.로아앤코 관계자는 “차바이오텍이 차백신연구소 지.,로아앤코그룹은 최근 불거진 차백신연구소 인수합병(M&A) &lsquo;막후 설계자&rsquo; 의혹에 대해 공식 입장을 내고 정면 반박에 나섰다.단순 투자 기회 소개와 일부 재무적 투자자(FI) 참여를 &lsquo;머니게임&rsquo;으로 치부하는 시장 일각의 시선에 대해 명예훼손에 따른 강력한 법적 조치를 예고했다.로아앤코 측은 최근 보도된 차백신연구소 구주 인수 및 유상증자 과정에서 온성준 회장과 로아앤코가 딜 전반을 기획했다는 주장은 주장은 전혀 사실이 아니라고 밝혔다.로아앤코 관계자는 &ldquo;차바이오텍이 차백신연구소 지,local,10,계약,,,0,,10.8,12.0,10,True
2026-03-27,Distribution,2026-03-20 14:04:00,Naver News,https://www.kpanews.co.kr/news/articleView.html?idxno=531409,"크레소티, '약국 원스탑 서비스' 전용 홈페이지 오픈…'구독 '서비스 - 약사공론",대한민국 약국 IT 솔루션의 선두주자 크레소티(대표이사 박경애)가 자사의 핵심 서비스인 ‘약국 원스탑 서비스’의 전용 홈페이지(onestop-service.co.,대한민국 약국 IT 솔루션의 선두주자 크레소티(대표이사 박경애)가 자사의 핵심 서비스인 ‘약국 원스탑 서비스’의 전용 홈페이지(onestop-service.co.,local,10,지오영,,,0,,10.8,12.0,10,True
2026-03-27,Distribution,2026-03-20 11:26:00,Naver News,https://www.yakup.com/news/index.html?mode=view&cat=17&nid=324929,"[약업신문]크레소티, ‘약국 원스탑 서비스’ 전용 홈페이지 오픈…“약국 경영도 구독 시대”","약국 IT 솔루션 선두주자 크레소티(대표이사 박경애)가 자사 핵심 서비스인 ‘약국 원스탑 서비스’ 전용 홈페이지(onestop-service.co.kr)를 오픈하며, 업계 최초로 ‘약국 경영 구독 모델’ 본격적인 확산을 선포했...","약국 IT 솔루션 선두주자 크레소티(대표이사 박경애)가 자사 핵심 서비스인 ‘약국 원스탑 서비스’ 전용 홈페이지(onestop-service.co.kr)를 오픈하며, 업계 최초로 ‘약국 경영 구독 모델’ 본격적인 확산을 선포했...",local,10,지오영,,,0,,10.8,12.0,10,False
2026-03-27,BD,2026-03-23 14:30:00,Naver News,https://www.apsk.co.kr/news/articleView.html?idxno=538925,"20년 만의 협심증 신약 '라넥사', 국내 미출시 상태로 철수 - 메디팜스투데이","20여년 만에 등장한 협심증 치료 신약으로 주목받았던 '라넥사서방정(성분명 라놀라진)'이 국내 허가 5년 만에 자진취하했다. 허가 이후 수입실적이 전무해, 사실상.","20여년 만에 등장한 협심증 치료 신약으로 주목받았던 '라넥사서방정(성분명 라놀라진)'이 국내 허가 5년 만에 자진취하했다. 허가 이후 수입실적이 전무해, 사실상",local,10,메나리니,,,0,,10.8,12.0,10,False
2026-03-27,Client,2026-03-27 13:24:00,Naver News,https://www.e-science.co.kr/news/articleView.html?idxno=128591,"먹는 비만 치료제 시대, 체중 감량 약물의 진화와 한계 - 이코노미사이언스","비만 치료제가 새로운 전환점을 맞고 있다. 단순한 식욕 억제제를 넘어, 호르몬과 대사 시스템을 정밀하게 조절하는 약물이 등장하면.","| 이코노미사이언스 정상훈 기자 |비만 치료제가 새로운 전환점을 맞고 있다. 단순한 식욕 억제제를 넘어, 호르몬과 대사 시스템을 정밀하게 조절하는 약물이 등장하면",local,10,릴리,,,0,,10.4,11.0,10,True
2026-03-27,Client,2026-03-25 08:02:00,Naver News,http://www.medisobizanews.com/news/articleView.html?idxno=136273,"폐암약 렉라자ㆍ타그리소, 사용량-약가협상 모니터링 약물","유한양행의 ‘렉라자정80mg’과 한국아스트라제네카의 ‘타그리소정 40mg, 80mg’이 나란히 올해 2분기 사용량-약가협상 모니터랑 약제로 지정됐다. 또 종근당의 당뇨병 치료제 ‘자누비아정’ 대웅제약의 건선 치료제 ‘압솔라정’ 등도 포함됐고 기관지확장제인 ‘툴로부테롤 패취제’는 보령바이오파마, 한미약품, 영진약품 등 16개 제약사 40개 품목이 대거 들어갔다.24일 건강보험공단은 2분기 모니터링 대상 152개 약물을 공개했다.다국적 제약사는 ▲한국화이자제약 ‘보술리프정’ ▲비아트리스코리아 ‘도브프렐라정’ ▲한국아스텔라스제약 ‘조스파.","유한양행의 ‘렉라자정80mg’과 한국아스트라제네카의 ‘타그리소정 40mg, 80mg’이 나란히 올해 2분기 사용량-약가협상 모니터랑 약제로 지정됐다. 또 종근당의 당뇨병 치료제 ‘자누비아정’ 대웅제약의 건선 치료제 ‘압솔라정’ 등도 포함됐고 기관지확장제인 ‘툴로부테롤 패취제’는 보령바이오파마, 한미약품, 영진약품 등 16개 제약사 40개 품목이 대거 들어갔다.24일 건강보험공단은 2분기 모니터링 대상 152개 약물을 공개했다.다국적 제약사는 ▲한국화이자제약 ‘보술리프정’ ▲비아트리스코리아 ‘도브프렐라정’ ▲한국아스텔라스제약 ‘조스파",local,10,아스트라제네카,,,0,,10.4,11.0,10,True
2026-03-27,Client,2026-03-26 08:22:00,Naver News,http://www.edaily.co.kr/news/newspath.asp?newsid=02915926645387256,한승현 로완 대표 “日 소프트뱅크와 치매 정복...올해 매출 6배 성장 기대”,인류가 직면한 가장 가혹한 질병 중 하나인 치매. 세계적인 고령화 추세 속에서 치매는 더 이상 개인의 불행이 아닌 국가적 과제로 부상했다. 이 거대한 장벽 앞에 정보기술(IT)과 의료 데이터를 결합한 디지털치료제(DTx)가 새로운 돌파구로 주목받고 있다.한승현 로완 ...,인류가 직면한 가장 가혹한 질병 중 하나인 치매. 세계적인 고령화 추세 속에서 치매는 더 이상 개인의 불행이 아닌 국가적 과제로 부상했다. 이 거대한 장벽 앞에 정보기술(IT)과 의료 데이터를 결합한 디지털치료제(DTx)가 새로운 돌파구로 주목받고 있다.한승현 로완 ...,local,10,바이오젠,,,0,,10.4,11.0,10,True
2026-03-27,Client,2026-03-27 05:56:00,Naver News,https://www.kpanews.co.kr/news/articleView.html?idxno=531762,"[특별기고] ""마운자로는 요술 방망이가 아니다"" - 약사공론","결심한 이유몸무게는 밝히고 싶지 않다. 40대 후반이 되어 가니 하루가 다르게 뱃살이 늘어간다. 더 이상 유니클로, 자라 이런 곳에서 바지를 살 수 없다.입을 수.","결심한 이유몸무게는 밝히고 싶지 않다. 40대 후반이 되어 가니 하루가 다르게 뱃살이 늘어간다. 더 이상 유니클로, 자라 이런 곳에서 바지를 살 수 없다.입을 수",local,10,마운자로,,,0,,10.4,11.0,10,False
2026-03-27,Client,2026-03-27 16:12:00,Naver News,https://www.jnilbo.com/news/articleView.html?idxno=90000028039,차세대 비만치료제 개발 돌입…춘추전국시대 열릴까 - 전남일보,글로벌 제약사들이 앞다퉈 차세대 비만치료제 개발에 나서면서 비만치료제 시장에 지각변동이 일어날지 관심이 쏠리고 있다.월스트리트저널(WSJ)은 지난 26일(현지시간.,글로벌 제약사들이 앞다퉈 차세대 비만치료제 개발에 나서면서 비만치료제 시장에 지각변동이 일어날지 관심이 쏠리고 있다.월스트리트저널(WSJ)은 지난 26일(현지시간,local,10,화이자,,,0,,10.4,11.0,10,False
2026-03-27,Client,2026-03-27 16:05:00,Naver News,https://biz.sbs.co.kr/article_hub/20000300405?division=NAVER,"더 효과 있고, 더 편리한 비만치료제 쏟아진다","]글로벌 제약사들이 앞다퉈 차세대 비만치료제 개발에 나서면서 비만치료제 시장에 지각변동을 예고 하고 있습니다.월스트리트저널(WSJ)은 현지시간 26일 비만치료제 개발 현황을 전하면서 ""향후 몇 년 안에 환자들이 여러 새로운 선택지를 갖게 될 전망""이라고 했습니다.비만치료제….","[위고비 (AFP=연합뉴스 자료사진)]글로벌 제약사들이 앞다퉈 차세대 비만치료제 개발에 나서면서 비만치료제 시장에 지각변동을 예고 하고 있습니다.월스트리트저널(WSJ)은 현지시간 26일 비만치료제 개발 현황을 전하면서 ""향후 몇 년 안에 환자들이 여러 새로운 선택지를 갖게 될 전망""이라고 했습니다.비만치료제…",local,10,릴리,,,0,,10.4,11.0,10,False
2026-03-27,Client,2026-03-24 07:02:00,Naver News,https://www.thebell.co.kr/free/content/ArticleView.asp?key=202603222206175360102916,"[더벨]'글로벌IB·빅파마·AI' 대거 출격, 더벨 바이오 포럼서 만난다","글로벌 빅파마 세션에는 노바티스의 야마구치 아사코(Yamaguchi Asako) 부국장, 베링거인겔하임의 레나 이와이(Lena Iwai) R&D 얼라이언스, 준 한(June Hahn) 글로벌 BD&L 한국 총괄, 아스텔라스의 토모히로 요시다(Tomohiro Yoshida)... ","글로벌 빅파마 세션에는 노바티스의 야마구치 아사코(Yamaguchi Asako) 부국장, 베링거인겔하임의 레나 이와이(Lena Iwai) R&D 얼라이언스, 준 한(June Hahn) 글로벌 BD&L 한국 총괄, 아스텔라스의 토모히로 요시다(Tomohiro Yoshida)... ",local,10,아스텔라스,,,0,,10.4,11.0,10,True
2026-03-27,Client,2026-03-27 16:46:00,Naver News,https://www.ppss.kr/news/articleView.html?idxno=290019,주 1회 주사제 시대 끝난다...비만치료제 시장 ‘춘추전국시대’ 서막 - ㅍㅍㅅㅅ PPSS,글로벌 제약사들이 앞다퉈 차세대 비만치료제 개발에 나서면서 비만치료제 시장에 관심이 쏠리고 있다.월스트리트저널(WSJ)은 26일(현지.,(ㅍㅍㅅㅅ 이천오 인턴기자) 글로벌 제약사들이 앞다퉈 차세대 비만치료제 개발에 나서면서 비만치료제 시장에 관심이 쏠리고 있다.월스트리트저널(WSJ)은 26일(현지,local,10,화이자,,,0,,10.4,11.0,10,False
2026-03-27,Client,2026-03-27 15:53:00,Naver News,https://www.yna.co.kr/view/AKR20260327122300009?input=1195m,비만치료제 춘추전국시대 열릴까 | 연합뉴스,글로벌 제약사들이 앞다퉈 차세대 비만치료제 개발에 나서면서 비만치료제 시장에 지각변동이 일어날지 관심이 쏠리고...,(서울=연합뉴스) 문관현 기자 = 글로벌 제약사들이 앞다퉈 차세대 비만치료제 개발에 나서면서 비만치료제 시장에 지각변동이 일어날지 관심이 쏠리고...,local,10,마운자로,,,0,,10.4,11.0,10,False
