date,category,published_date,site_name,url,title,summary,region,score_ag,keywords,reward_x,rl_score,lgbm_score,reward_y,score_ag_norm,lgbm_score_norm,final_score,is_top20
2026-02-12,BD,2026-02-12 22:54:00,Naver News,https://www.bzeronews.com/news/articleView.html?idxno=811381,‘설 연휴 가축전염병 차단’ 총력 대응 - 공뉴스,"설 연휴를 앞두고 범정부가 고병원성 조류인플루엔자(AI), 아프리카돼지열병(ASF), 구제역 확산 차단을 위해 ‘24시간 비상 대응체계’와 전국 단위 일제 소독을.",local,8,백신,,,0.19637034996216568,,0.8,0.19637034996216568,0.6189111049886497,False
2026-02-12,BD,2026-02-12 15:02:00,Naver News,https://www.ekn.kr/web/view.php?key=20260212021488979,항암제·비만약…올해 K-신약 허가 후보는,국내 일부 제약바이오기업들이 자체 신약에 대해 국내외 규제기관 허가심사 결과를 기다리고 있어 올해도 다수의 국산 신약이 탄생할지 주목된다. 장기간 막대한 비용을 투입한 연구개발(R..,local,8,유통계약,,,0.19555956449628475,,0.8,0.19555956449628475,0.6186678693488854,False
2026-02-12,BD,2026-02-12 19:54:00,Naver News,http://sjbnews.com/news/news.php?number=871871,"남원시보건소, 희귀질환 의료비지원 대상 확대","남원시보건소는 희귀질환 의료비지원 대상 질환이 기존 1,338개에서 75개가 추가돼 총 1,413개로 늘어난다고 밝혔다. 또 소득·재산 기준이 지난해부터 연령 구분 없이 기준 중위소득 140% 미만으로 완화돼 더 많은 환자가 혜택을 받을 수 있게 됐다고 전했다. 의료비 지원 항목은 희귀질환 및 그 합병증 치료에 소요되는 요양급여 비용 중 본인부담금이다. 보조기기 구입비, 간병비, 특수식이 구입비 등도 기준에 적합할 경우 지원받을 수 있다.",local,8,합병,,,0.19488674483422602,,0.8,0.19488674483422602,0.6184660234502677,False
2026-02-12,BD,2026-02-12 08:36:00,Naver News,http://www.segyebiz.com/newsView/20260212503742?OutUrl=naver,AI로 ‘신약 개발’하는 시대… 글로벌 제약사와 국내 제약사의 차이는,"글로벌 제약사들이 신약 개발 등에 인공지능(AI)을 적극적으로 활용하고 있는 반면, 국내 기업들은 아직 이를 따라가지 못하고 있다는 지적이 나온다. 12일 제약·바이오 업계에 따르면 국내 기업들은 AI 도입을 통해 신약 개발 등을 추진 중이다. 대표적인 예로, 대웅제약은 A...",local,8,화이자,,,0.1947712806466542,,0.8,0.1947712806466542,0.6184313841939962,False
2026-02-12,BD,2026-02-13 06:02:00,Naver News,https://www.dailypharm.com/user/news/335726?REFERER=NP,[데일리팜]이번엔 고등학교 사칭사기...약국 상대 위조공문 나돌아,"서울 한 고등학교를 사칭한 약국 상대 위조 공문이 시중에 돌고 있는 것으로 확인돼 주의가 요구된다. 12일 서울시약사회 관계자에 따르면 최근 서울 효문고등학교는 해당 학교를 사칭하는 내용의 위조 공문이 돌고 있다면서 회원 약국들에 주의를 당부했다. 공문의 발신처는 서울 효문고등학교 행정실이며, 내용은 2026년도 의료용품 구매 건이다. 위조된 것으로 확인된 공문에는 특정….",local,8,계약,,,0.1947712805967562,,0.8,0.1947712805967562,0.6184313841790268,False
2026-02-12,BD,2026-02-12 05:34:00,Naver News,https://www.dailymedi.com/news/news_view.php?wr_id=933862,유원상 유유제약 대표 승부수 '고양이 의약품',﻿﻿﻿﻿﻿유원상 유유제약 대표가 반려묘 '아리'를 소개하고 있다.,local,8,CSO,,,0.19320770462579023,,0.8,0.19320770462579023,0.617962311387737,False
2026-02-12,BD,2026-02-13 06:12:00,Naver News,https://www.hitnews.co.kr/news/articleView.html?idxno=73887,"""약가제도 설계, 지속가능성 보장하는 바텀라인 설정 필요""","정부의 약가제도 개편안과 관련 제네릭 약가 우대, 기본 산정률 적용, 기등재 약가 조정 전반에서 '지속가능성을 보장하는 bottom line'을 설정해야 한다는 제언이 나왔다. 단기적 인하가 아닌, 지속적으로 생산 가능한 채산성을 전제로 한 약가제도 설계가 필요하다는 주장이다. 한국제약바이오협회가 발간한 '지속가능한 약가제도 개선 방안'(KPBMA FOCUS NO.34) 보고서에서는 정부 개편안이 제시한 산정체계 개편과 제네릭 산정률 조정, 혁신성 가산 제도 변경 등이 산업 구조를 충분히 반영하지 못할 경우 제네릭 산업의 지속가능성.",local,8,신약,,,0.19124379839526418,,0.8,0.19124379839526418,0.6173731395185792,False
2026-02-12,BD,2026-02-11 15:52:00,Naver News,https://www.rapportian.com/news/articleView.html?idxno=232502,"유유제약, 고양이 바이오의약품으로 60조 동물의약품 시장 정조준",“저분자 케미컬 기준으로 보면 유유제약은 전 세계 약 800위 수준일 것이다. 하지만 고양이 바이오의약품 하나만 성공해도 글로벌 탑5에 들어갈 수 있다.”유유제약 유.,local,8,CSO,,,0.19115505712498954,,0.8,0.19115505712498954,0.6173465171374968,False
2026-02-12,BD,2026-02-11 17:16:00,Naver News,https://www.insight.co.kr/news/542794,"“기술 산업에서 캐시카우로”... K-바이오 기업, 수익 본격화",국내 바이오 기업들이 연구개발 중심 적자 구조에서 벗어나 기술수출과 신약 매출을 통한 본격적인 수익 창출 단계로 진입했습니다.,local,8,GSK,,,0.1906606854657765,,0.8,0.1906606854657765,0.6171982056397329,False
2026-02-12,BD,2026-02-12 16:10:00,Naver News,https://www.ajunews.com/view/20260212144034710,[제약·바이오 뉴스픽] 대원제약·SK바이오팜·삼성바이오에피스·자생한방병원 | 아주경제,"대원제약, 골라 먹는 감기약 대원콜 연질캡슐 3종 출시대원제약은 증상에 따라 차별화된 처방을 적용한 감기약 브랜드 대원콜 연질캡슐 시리즈를 새롭게 출시했다고 12...",local,8,바이엘,,,0.18988748732413133,,0.8,0.18988748732413133,0.6169662461972394,False
2026-02-12,BD,2026-02-13 05:00:00,Naver News,http://www.mkhealth.co.kr/news/articleView.html?idxno=77506,"간판 다시 세우는 제약·바이오, 헬스케어 업계","국내 제약·바이오·헬스케어 업계에서 최근 사명과 브랜드, CI를 바꾸는 사례가 이어지고 있다. 기업들은 명칭과 시각 요소를 재정비하며 사업 범위와 기업 정체성을 동시에 조정하고 있다. 제약 중심 구조에서 헬스케어 전반으로 사업 영역을 넓히는 과정에서, 기업 전략을 직접적으로 드러내는 수단으로 새로운 사명과 브랜드, CI를 적극 활용하고 있는 것.사명 변경 사례 가운데 가장 최근 움직임은 일동헬스케어다.",local,8,인수,,,0.18988748732413133,,0.8,0.18988748732413133,0.6169662461972394,False
2026-02-12,BD,2026-02-12 16:40:00,Naver News,https://www.rapportian.com/news/articleView.html?idxno=232548,"바이오의약품협, ‘알츠하이머병 치료제 개발 패러다임 동향 보고서’ 발간",한국바이오의약품협회는 글로벌 알츠하이머병 치료제 신약 개발 환경 변화와 기술이전 트렌드를 분석한 ‘알츠하이머병 치료제 개발 패러다임과 기술이전 동향 보고서’를 발간했.,local,8,로슈,,,0.18986342907932705,,0.8,0.18986342907932705,0.616959028723798,False
2026-02-12,BD,2026-02-12 09:40:00,Naver News,http://www.press9.kr/news/articleView.html?idxno=72337,"[Generic Trend]비씨월드-영진약품, '서튜러' 제네릭 선점 주인공은?","얀센의 다제내성 결핵 치료제 '서튜러(성분명 베다퀼린)'의 제네릭 시장에서 비씨월드제약과 영진약품의 경쟁이 주목된다.식품의약품안전처에 따르면 지난해 12월 24일자로 베다퀼린 성분 제제의 허가신청이 접수됐다.서튜러에 대한 제네릭 도전은 지난해 9월 4일 비씨월드제약이 특허심판을 청구하면서 시작됐다. 여기에 9월 16일자로 영진약품까지 심판을 청구, 제네릭 시장을 두고 양사의 경쟁이 시작됐다.특허심판 결과는 무승부로 끝났다. 지난해 12월 17일 특허심판원으로부터 양사가 함께 인용 심결을 받아냈던 것.하지만 심결 직후인.",local,8,얀센,,,0.18986342907932705,,0.8,0.18986342907932705,0.616959028723798,False
2026-02-12,BD,2026-02-12 13:14:00,Naver News,https://www.monews.co.kr/news/articleView.html?idxno=409619,"美 골관절염 시장 목전에 둔 K-바이오, 패러다임 바꾸나 - 메디칼업저버",거대한 미충족 수요인 질병조절 골관절염 치료제(DMOAD) 시장을 선점하기 위한 국내 바이오업계의 발걸음이 빨라지고 있다.코오롱티슈진.,local,8,판권,,,0.18986342907932705,,0.8,0.18986342907932705,0.616959028723798,False
2026-02-12,BD,2026-02-13 06:02:00,Naver News,https://www.dailypharm.com/user/news/335728?REFERER=NP,"[데일리팜]지엘파마, '프레가발린' 성분 최초 구강붕해정 상업화","지엘파마가 국내 최초로 신경병증성 통증 치료에 사용되는 프레가발린 성분 제제에 구강붕해정 제형 제품 상업화에 성공했다. 기존에는 캡슐과 정제 제형만 있었다. 구강붕해정은 약가 산정 시 유리하다는 평가가 있어 업계의 관심이 모아지고 있다. 식품의약품안전처는 12일 지엘파마의 리리엘구강붕해정(프레가발린) 3개 품목(50mg, 75mg, 150mg)을 허가했다. 이 제품은 ▲성인에서 말초….",local,8,제네릭,,,0.18986342907932705,,0.8,0.18986342907932705,0.616959028723798,False
2026-02-12,BD,2026-02-12 18:30:00,Naver News,http://www.bizwnews.com/news/articleView.html?idxno=125279,"삼성바이오에피스, '아일리아' 글로벌 특허 장벽 모두 넘었다…""합의 완료""","삼성바이오에피스(대표 김경아)는 안과질환 치료제 오퓨비즈(성분명 애플리버셉트, 아일리아 바이오시밀러) 관련 오리지널 의약품 회사인 리제네론(Regeneron), 바이엘(Bayer)과 2㎎ 제형에 대한 미국 합의·라이선스 계약(Settlement and License Agreement)을 체결했다고 12일 밝혔다.이번 합의에 따라 삼성바이오에피스는 오는 2027년 1월 중 미국에서 오퓨비즈를 출시할 수 있게 됐으며 지난 1월 유럽 등에 이어 아일리아 바이오시밀러에 대한 글로벌 특허 합의를 완료하게 됐다.오퓨비즈는 지난 2.",local,8,라이선스,,,0.18909270871011866,,0.8,0.18909270871011866,0.6167278126130356,False
2026-02-12,BD,2026-02-12 11:40:00,Naver News,http://www.biotimes.co.kr/news/articleView.html?idxno=27067,"‘원샷 치료’ CAR-T 혁신, 체외 조작 없이 직접 주입식 ‘인비보 CAR-T’로 진화","세포치료제 시장에서 차세대 ‘원샷 치료’ 혁신으로 불리는 인비보(In vivo) 카티가 글로벌 경쟁의 중심으로 떠오르고 있다. 복잡한 제조 공정과 높은 비용이라는 기존 카티 세포치료제의 구조적 한계를 근본적으로 극복하는 기술로 평가되며, 글로벌 제약사뿐 아니라 국내 바이오텍까지 기술 확보 경쟁에 뛰어드는 중이다. ◇ 인비보 카티, 체내 재프로그래밍으로 기존 한계 극복카티(CAR-T, 키메릭항원수용체 T세포) 치료제는 환자의 T세포를 개조해 암세포만 타깃으로 공격하도록 하는 혁신적 항암 치료제다.",local,8,릴리,,,0.18909270871011866,,0.8,0.18909270871011866,0.6167278126130356,False
2026-02-12,BD,2026-02-13 06:02:00,Naver News,https://www.dailypharm.com/user/news/335718?REFERER=NP,"[데일리팜]유한양행, 7년간 기술료 4600억 유입…수익성 바로미터",유한양행이 신약 기술수출을 본격적으로 시작한 2019년부터 유입된 누적 기술료 수익이 4600억원에 달했다. 항암신약 렉라자가 기술수출 이후 개발 단계 진전과 해외 허가로 지속적으로 기술료 수익을 창출했다. 유한양행은 지난 7년 동안 기술료 수익 유입 규모에 따라 영업이익이 출렁대는 패턴이 반복됐다. 13일 유한양행에 따르면 이 회사의 지난해 기술료 수익은 1041억원으로 집계….,local,8,라이선스,,,0.18378916808718918,,0.8,0.18378916808718918,0.6151367504261567,False
2026-02-12,BD,2026-02-12 06:00:00,Naver News,http://www.bosa.co.kr/news/articleView.html?idxno=2269911,"톱10 제약사, 지난해 견조한 매출 성장ㆍ수익성 개선","주요 제약사들이 지난해 견조한 매출 성장 속에서 영업이익과 순이익 등 수익성을 끌어올린 것으로 나타났다.일간보사·의학신문이 2025년 영업(잠정)실적을 공개한 제약사 중 매출 상위 10개 기업의 영업실적을 집계했다. 이번 집계에서 유한양행, GC녹십자, 종근당, 대웅제약, 한미약품, 보령, JW중외제약, 대원제약 등 8개사는 연결 재무제표 기준이고, 동아에스티와 HK이노엔 2개사는 별도 재무제표 기준 잠정치다.2025년 10개 제약사의 매출은 전년 대비 8.98% 증가한 13조 2135억원, 영업이.",local,8,코프로모션,,,0.18378916808718918,,0.8,0.18378916808718918,0.6151367504261567,False
2026-02-12,BD,2026-02-11 18:20:00,Naver News,http://www.finomy.com/news/articleView.html?idxno=249591,"탈모 치료 관련주, '껑충껑충' 프롬바이오·현대약품·샤페론... '주르륵' TS트릴리온","현대경제신문 홍미경 기자 | 탈모 치료 관련주들이 전 거래일 대비 0.42% 상승으로 장을 마감했다.11일 한국거래소에 따르면 프롬바이오, 현대약품, JW신약, 샤페론은 상승했다.프롬바이오와 현대약품은 전 거래일 대비 각각 127원, 670원 오른 1595원과 1만3250원에 거래를.",local,8,CSO,,,0.18378916808718918,,0.8,0.18378916808718918,0.6151367504261567,False
2026-02-12,BD,2026-02-10 06:06:00,Naver News,https://www.medipana.com/news/articleView.html?idxno=406702,"동아에스티, 올해 '성장사업부' 본격 가동…제품 시너지 극대화 노려 - 메디파나뉴스",동아에스티가 올해 전담조직을 통해 성장호르몬 제품 시너지 극대화를 노린다. 회사 대표 성장호르몬 치료제 '그로트로핀'과 성조숙증·.,local,8,입센,,,0.1837466185878561,,0.8,0.1837466185878561,0.6151239855763567,False
2026-02-12,BD,2026-02-12 07:02:00,Naver News,https://www.thebell.co.kr/free/content/ArticleView.asp?key=202602111532006680102030,"[더벨]HK이노엔, '자체제품'의 힘 5년만에 두자리 이익률 회복","전문의약품 중에서도 원가율이 높은 도입품목은 화이자 코로나19 백신 코미나티주, 로슈의 아바스틴, 보령 카나브 패밀리 등에 그친다. 상대적으로 이익률이 낮은 도입·유통 사업 의존도가 제한적인 수준에 머물면서... ",local,8,화이자,,,0.18331085830991478,,0.8,0.18331085830991478,0.6149932574929744,False
2026-02-12,BD,2026-02-12 15:44:00,Naver News,https://www.kdpress.co.kr/news/articleView.html?idxno=202709,"(주)마초의사춘기, (주)브라더스키퍼 인수로 NXC 비즈니스 본격 확장 - 데일리경제",자연·기술·경험이 결합된 NXC(Nature Experience Commerce) 기반의 플랜테리어·조경·바이오필리아 디자인 그룹 마초의사춘기(대표 김광수)는 2.,local,8,M&A,,,0.18301414780652359,,0.8,0.18301414780652359,0.614904244341957,False
2026-02-12,BD,2026-02-11 15:24:00,Naver News,https://www.thepublic.kr/news/articleView.html?idxno=294127,CAR-T 패러다임 전환…체내 생산 ‘인비보 카티’ 차세대 치료제로 부상,"암세포만 선택적으로 공격해 정상 세포 손상을 최소화하는 카티(CAR-T) 세포치료제를 ‘주사 한 방’으로 대체하려는 움직임이 일면서 글로벌 제약사들의 관심이 집중되고 있다. 환자의 세포를 체외에서 배양하던 기존 방식과 달리, 체내에서 직접 치료 세포를 만들어내.",local,8,BMS,,,0.18301414780652359,,0.8,0.18301414780652359,0.614904244341957,False
2026-02-12,BD,2026-02-12 06:02:00,Naver News,https://www.dailypharm.com/user/news/335683?REFERER=NP,[데일리팜]대형 제약바이오 실적 동반 호조...R&D 경쟁력의 힘,"지난해 대형 제약바이오기업들이 호전된 실적 성적표를 받아들었다. 신약, 바이오시밀러, 복합신약, 위탁생산개발(CDMO) 등 연구개발(R&D) 역량으로 구축한 차별화된 경쟁력이 실적 상승의 원동력으로 작용했다. 삼성바이오로직스와 셀트리온은 국내 제약바이오산업 실적 신기록을 연거푸 갈아치웠다. 전통제약사들도 R&D 경쟁력을 기반으로 실적 신기록 행진을 동반 작성했다.",local,8,코프로모션,,,0.18301414780652359,,0.8,0.18301414780652359,0.614904244341957,False
2026-02-12,BD,2026-02-12 07:14:00,Naver News,https://www.newsway.co.kr/news/view?ud=2026021114331423621,"김정균號 보령, 신약 '카나브' 확장 전략 가속화 - 뉴스웨이","보령이 자체 신약 카나브를 기반으로 한 복합제 라인업 확대 전략을 통해 2023년 역대 최대 실적을 달성했다. 복합신약 BR1018의 임상 3상에서 우수한 결과를 확보하며, 특허 만료와 약가 인하 소송 등 변수에도 불구하고 시장 입지를 강화하고 있다.",local,8,판권,,,0.18301414761538004,,0.8,0.18301414761538004,0.614904244284614,False
2026-02-12,BD,2026-02-12 12:30:00,Naver News,http://www.medisobizanews.com/news/articleView.html?idxno=134572,"LG화학, 진통제 신약 ‘엑스파렐’ 장착 … 실적 고공비행에 ‘탄력’","2023년 첫 매출 1조원을 달성한 LG화학 생명과학사업본부(이하 LG화학)가 올해부터 또 다른 신성장 동력을 안착시키는 데 주력한다.LG화학은 그동안 성장호르몬 '유트로핀'을 비롯해 당뇨 치료제 '제미글로', 관절염ㆍ류마티즘 치료제 '유셉트', 백신 '유펜타', 난임 치료제, 신장암 치료제 '포티브다' 등 주력 품목을 앞세워 성장을 거듭하며 고공행진을 이어왔다.여기에 올해 국소 지속형 진통제 신약인 '엑스파렐'을 국내 시장에 성공적으로 안착시켜 매출 상향 곡선을 이어가겠다는 복안이다. 특히 LG화학은 엑스파렐의 아시아 지역 판권을.",local,8,판권,,,0.18301414757910747,,0.8,0.18301414757910747,0.6149042442737321,False
2026-02-12,BD,2026-02-06 11:18:00,Naver News,https://www.medicopharma.co.kr/news/articleView.html?idxno=67028,"‘허·평·협 연계 1호’ 빌베이, 상급종합병원 안착…처방 물꼬 텄다","허가-평가-협상 연계 시범사업 1호 약제인 빌베이 캡슐(성분명 오데빅시바트, 이하 빌베이)이 최근 급여 등재에 이어 상급종합병원 처방권에 진입했다. 신속 허가와 조기 급여 진입을 위한 제도 적용 사례가 실제 처방 단계까지 이어졌다는 점에서 주목된다.6일.",local,8,입센,,,0.18301414737205,,0.8,0.18301414737205,0.6149042442116149,False
2026-02-12,BD,2026-02-12 20:40:00,Naver News,http://www.lawissue.co.kr/view.php?ud=202602122038152125204ead0791_12,"로킷헬스케어, 美 노스웰 헬스와 피부암·창상 재생 기술 MCA 체결","AI 초개인화 장기재생 플랫폼 기업 로킷헬스케어가 미국 동부 최대 의료 네트워크인 노스웰 헬스와 피부암 재생 및 창상 재생 기술 협력을 위한 전략적 상호 비밀유지계약(MCA)을 체결했다고 12일 밝혔다.양사는 JP모건 위크 기간 중 계약을 체결했다. 향후 파일럿 연구 구조, 임상 및 연.",local,8,제휴,,,0.18273340389008189,,0.8,0.18273340389008189,0.6148200211670245,False
2026-02-12,BD,2026-02-13 06:07:00,Naver News,http://www.inews24.com/view/1939212,인도産 바이오시밀러가 몰려온다,"5년간 1천억 루피 투입…R&D부터 상용화까지 지원 나서 인력·임상 늘리고 심사 효율화…""국내 바이오에 위협요인"" 제네릭(복제약) 강국인 인도가 바이오시밀러 중심의 바이오의약품 시장 공략에 속도를 내며 국내 바이오업계에 긴장감을 불러 일으키고 있다. 연구개발(R&D)부터 임상·생산·상용화까지 전 주기를 지원하는 정책을 가동하면서, 저비용 구조를 바탕으로 한 가격 경쟁력이 글로벌 시장 판도를 흔들 수 있다는 전망이 나온다.",local,8,제네릭,,,0.18272246774871898,,0.8,0.18272246774871898,0.6148167403246156,False
2026-02-12,BD,2026-02-12 16:40:00,Naver News,https://kormedi.com/?p=2789528,"일동제약·제일파마 작년 매출 뒷걸음질, 올해 반등할까 - 코메디닷컴",국내 주요 제약사 가운데 일동제약과 제일파마홀딩스는 지난해 매출이 뒷걸음질했다. 사진=일동제약·제일파마홀딩스 일동제약이 지난해 소폭 쪼그라든 매출 성적표를 내놨다. 실적 발표를 앞둔 제일파마홀딩스도 지난해 매출이 감소한 것으로 관측된다. 둘 다 다국적 제약사에서 도입한 약물의.,local,8,코프로모션,,,0.18272246774871898,,0.8,0.18272246774871898,0.6148167403246156,False
2026-02-12,BD,2026-02-12 17:49:00,Naver News,https://www.mk.co.kr/article/11961464,"'아일리아' 특허 분쟁 마침표 … 삼성에피스, 美 9조원 시장 겨냥 - 매일경제","심층 분석: 이 뉴스는 왜 나왔나? 삼성바이오에피스가 글로벌 특허 분쟁을 마침내 마무리하고, 2027년 1월부터 연간 9조 원 규모의 미국 시장에 안과질환 치료제 '아일리아' 바이오시밀러 '오퓨비즈'를 출시할 수 있게 되었다는 소식이 나왔어요. 🤩 이번 합의는 단순히 미국 출시의 법적 불확실성을 해소하는 것을 넘어, 유럽 등 주요 시장에서도 이미 특허 합의를 완료함으로써 '아일리아' 바이오시밀러 관련 글로벌 특허 분쟁을 완전히 정리했다는 점에서 의미가 깊답니다.",local,8,리제네론,,,0.18272246750569,,0.8,0.18272246750569,0.614816740251707,False
2026-02-12,BD,2026-02-13 05:34:00,Naver News,http://www.mjmedi.com/news/articleView.html?idxno=62096,[기고] 재택의료가 ‘거실 속 응급실’인가? 번지수 잘못 찾은 ‘응급처치 능력’ 논란,"최근 재택의료 시범사업 확대 논의에서 또 다시 케케묵은 레퍼토리가 등장했다. 한의계의 참여를 두고 “응급상황 대처 능력이 부족하다”는 이유로 반대하는 목소리다. 이는 재택의료라는 제도의 본질을 전혀 이해하지 못했거나, 알면서도 밥그릇을 지키기 위해 애써 외면하는 궤변에 불과하다. 결론부터 말하자면, 재택의료는 ‘거실에 차린 응급실’이 아니다. 첫째, 한의사는 현대적 의료 교육을 통해 검증된 응급처치 역량을 갖추고 있다.한의사가 응급상황에서 혈자리나 누르고 있을 것이라는 생각은 무지에서 비롯된 편견이다.",local,8,합병,,,0.18267061069811982,,0.8,0.18267061069811982,0.6148011832094359,False
2026-02-12,BD,2026-02-12 16:12:00,Naver News,http://www.metroseoul.co.kr/article/20260212500634,"K제약, 신약개발 자회사로 돌파구 찾는다","혁신 신약개발을 위해 설립한 자회사들이 제몫을 톡톡히 하고 있다. 국내 중대형 제약사들이 기존 사업을 유지하는 가운데 자체 신약 확보로 수익성을 개선하고 연구개발 사업을 확보하는 통로로서 전문 자회사들의 역할이 커지고 있다. 12일 국내 제약·바이오 업계에 따르면, 한.",local,8,코프로모션,,,0.18252690245320757,,0.8,0.18252690245320757,0.6147580707359622,False
2026-02-12,BD,2026-02-13 04:33:00,Naver News,https://www.donga.com/news/Economy/article/all/20260212/133347742/2,150년 기술력으로 바이오 허브 꿈꾼다,싸토리우스코리아바이오텍(유)(대표 김덕상)은 1870년 독일 괴팅겐에서 시작한 글로벌 생명과학 기업 싸토리우스의 한국 법인으로 2005년 설립 이후 20년간 국내 바이오 산업과 함께 성장해왔다. 국내 주요 바이오·제약 대기업들과 파트너십을 구축하며 전 세계 60여 곳….,local,8,파트너십,,,0.18239679376511797,,0.8,0.18239679376511797,0.6147190381295353,False
2026-02-12,BD,2026-02-11 16:20:00,Naver News,http://www.metroseoul.co.kr/article/20260211500671,"에이비엘 이어 올릭스까지, 국내 제약 CNS 경쟁은 'BBB 싸움'","에이비엘바이오에 이어 올릭스까지 중추신경계(CNS) 질환에 중점을 둔 경쟁에 가세하면서 플랫폼 기술력이 주목받고 있다. CNS 치료제 개발의 핵심 난제로 꼽히는 혈액뇌장벽(BBB) 연구개발에 업계의 관심이 집중되고 있다. 11일 국내 제약·바이오 업계에 따르면, 올릭스.",local,8,GSK,,,0.18227600061778448,,0.8,0.18227600061778448,0.6146828001853353,False
