date,category,published_date,site_name,url,title,summary,region,score_ag,keywords,reward_x,rl_score,lgbm_score,reward_y,score_ag_norm,lgbm_score_norm,final_score,is_top20
2026-02-12,Client,2026-02-12 17:13:00,Naver News,https://www.sedaily.com/article/20008625?ref=naver,1위 PBM 선호의약품 됐다…美서 날개 단 삼성에피스,미국 1위 처방약급여관리업체(PBM) 익스프레스스크립츠(ESI)가 처방집에서 오리지널 의약품은 물론 후속 신약까지 제외하고 삼성에피스홀딩스(0126Z0)의 자회사 삼성바이오에피스 바이오시밀러를 선호의약품으로 채택했다. ESI가 미국 PBM 시장의 약 30%를 점유하고.,local,10,암젠,,,0.18378916785015778,,1.0,0.18378916785015778,0.7551367503550472,False
2026-02-12,Client,2026-02-12 17:57:00,Naver News,https://www.wowtv.co.kr/NewsCenter/News/Read?articleId=A202602120404&t=NNv,"[단독] 마운자로 보험청구 최대 700% 폭증...""보험사기 신고 연장""",대표적인 비만 치료 주사제 마운자로는 당뇨나 기타 질환에 대한 처방으로 보험금을 청구하면 절반이 넘는 금액을 보장받을 수 있습니다. 마운자로 실비 청구 건수가 4개월 만에 평균 570% 급증하면서 이 같...,local,10,마운자로,,,0.18336285670325145,,1.0,0.18336285670325145,0.7550088570109754,False
2026-02-12,Client,2026-02-12 11:00:00,Naver News,http://www.bosa.co.kr/news/articleView.html?idxno=2269946,2형 당뇨 환자에게 오젬픽 급여 의미는?,"2형 당뇨 치료를 위한 다양한 의약품이 존재하지만 목표 혈당 조절 달성이 어려운 가운데 특히 비만을 동반한 당뇨 환자들에게 노보노디스크제약 오젬픽이 혈당 조절의 해결점이 될 수 있을지 주목된다.국내 당뇨 환자의 당화혈색소 기준 혈당 조절 목표인 6.5% 미만에 도달한 비율은 3명 중 1명이었으며 당화혈색소 8% 이상으로 적극적인 혈당 조절 치료가 필요한 경우도 16%였다.특히 2형 당뇨 환자는 고혈압, 고콜레스테롤 및 비만 등 동반 질환 유병률이 높아 동반 질환에 따른 합병증 위험 감소를 포함한 통합.",local,10,노보노디스크,,,0.18331085830991478,,1.0,0.18331085830991478,0.7549932574929744,False
2026-02-12,Client,2026-02-12 11:08:00,Naver News,http://www.mkhealth.co.kr/news/articleView.html?idxno=77612,[제약소식] JW중외제약 '세계 빈혈 인식의 날' 맞아 사내 캠페인 전개 등,JW중외제약은 '세계 빈혈 인식의 날'을 맞아 빈혈 조기 진단과 치료 필요성을 알리기 위한 임직원 대상 캠페인을 실시했다고 12일 밝혔다.매년 2월 13일은 환자혈액관리학회(SABM)와 휴먼터치미디어재단이 2022년 공동 제정한 세계 빈혈 인식의 날이다. JW중외제약은 이를 소개하는 이미지와 함께 빈혈의 조기 진단 및 치료 중요성을 담은 콘텐츠를 제작해 내부 커뮤니케이션 채널에 공유했다. 임직원을 대상으로 빈혈 관련 퀴즈 이벤트도 진행하고 추첨을 통해 기념품을 제공했다.빈혈은 혈액이 조직에 충분한 산소를 공급하지 못해 저산소증을 유.,local,10,한독,,,0.18331085826228438,,1.0,0.18331085826228438,0.7549932574786853,False
2026-02-12,Client,2026-02-12 16:12:00,Naver News,http://www.smedaily.co.kr/news/articleView.html?idxno=351473,삼성바이오에피스 '아일리아' 특허 합의…오퓨비즈 2027년 1월 미국 출시 예상,"삼성바이오에피스가 '아일리아(Eylea, 성분명 애플리버셉트)' 제작사 리제네론·바이엘과의 특허 소송에 합의함으로써 바이오시밀러 '오퓨비즈(Opuviz)' 2mg 제형을 미국에 진출시킬 수 있게 됐다.12일 삼성바이오에피스에 따르면 이번 합의로 2027년 1월 중 미국에 오퓨비즈를 출시할 수 있게 됐다. 삼성바이오에피스는 지난 1월 유럽에 대한 글로벌 특허 합의도 완료했다.삼성바이오에피스 관계자는 ""이번 합의로 당사의 전 세계 아일리아 바이오시밀러 2mg 제형 특허 분쟁이 모두 해소돼 제품 출시 기반이 마련됐다""며 ""앞으로도 안과질.",local,10,바이엘,,,0.18301414780652359,,1.0,0.18301414780652359,0.754904244341957,False
2026-02-12,Client,2026-02-12 06:12:00,Naver News,https://www.hitnews.co.kr/news/articleView.html?idxno=73837,"""제2의 신약 후보 벨바라페닙 키운다""… 규제 장벽 허물고 '속도전'","식품의약품안전처는 길잡이 프로그램과 GIFT 운영 성과를 바탕으로 올해 제도를 개선하고 업계와의 소통을 강화할 계획이다. 운영 과정에서 드러난 보완점을 반영해 사전상담 이력 카드 발급, 글로벌 혁신제품 신속심사(GIFT) 지정 기준 명확화 등을 개선할 방침이다.김희성 식약처 식품의약품안전평가원 사전상담과 과장은 11일 한국프레스센터에서 '2026년 신기술·신개념 글로벌 의약품 개발·제품화 지원 간담회'에서 이같은 계획을 밝혔다.'길잡이(GIL-Jabi) 제품화 집중지원 프로그램'은 식의약규제과학혁신법에 따라 기술적 우수성이 높은 혁.",local,10,노바티스,,,0.18301414780652359,,1.0,0.18301414780652359,0.754904244341957,False
2026-02-12,Client,2026-02-12 11:02:00,Naver News,https://www.medicopharma.co.kr/news/articleView.html?idxno=67096,"휴온스, 톡신 中판매 준비단계 진입…품질기준 절차 착수","휴온스바이오파마가 중국 보툴리눔톡신 시장 공략에 속도를 내고 있다. 지난 1월 품목허가를 획득한 데 이어, 실제 판매를 위한 품질 기준 절차에 착수하면서 상업화가 본궤도에 올랐다는 평가다.12일 중국 국가약품감독관리국(NMPA) 산하 약품심사평가센터(CD.",local,10,애브비,,,0.18301414780652359,,1.0,0.18301414780652359,0.754904244341957,False
2026-02-12,Distribution,2026-02-11 11:22:00,Naver News,http://www.newswatch.kr/news/articleView.html?idxno=77642,"비알피랩스, '방광건강 안심요 1000' 출시",비알피랩스가 중장년층의 배뇨 건강 관리를 위한 약국 전용 건강기능식품 '방광건강 안심요 1000'을 출시했다고 11일 밝혔다.이번 신제품은 노화와 스트레스로 방광 기능 저하를 겪기 쉬운 중장년층을 대상으로 기획됐다. 잦은 화장실 이용이나 야간뇨 등으로 일상생활에 불편을 느끼는 소비자를 주요 타깃으로 한다. 제품명에 포함된 '1000'은 핵심 기능성 원료를 고함량으로 설계했다는 의미다.방광건강 안심요 1000에는 식품의약품안전처로부터 배뇨 기능 개선 기능성을 인정받은 개별인정형 원료인 호박씨등복합추출물이.,local,10,바로팜,,,0.18301414780652359,,1.0,0.18301414780652359,0.754904244341957,False
2026-02-12,Client,2026-02-11 12:14:00,Naver News,https://new.dailypharm.com/user/news/335643?REFERER=NP,[데일리팜]'반플리타' 국내 진입…급성골수성백혈병 표적치료 전선 확대,"새로운 급성골수성백혈병(AML) 표적치료제 '반플리타'가 국내 1차 치료 옵션으로 합류하며 경쟁 구도가 치열해졌다. 그동안 반플리타는 안전성 우려로 글로벌 규제기관의 허가를 얻지 못하며 상용화까지 좌절을 겪었던 약물이다. 다만 생존기간 이득을 근거로 재평가되면서 기존 '라이답', '조스파타' 중심이던 FLT3 표적치료제 시장에도 변화 가능성이 제기되고 있다. 예후가 불량한 FLT….",local,10,아스텔라스,,,0.18301414737205,,1.0,0.18301414737205,0.754904244211615,False
2026-02-12,Client,2026-02-11 16:23:00,Naver News,http://www.wowtv.co.kr/NewsCenter/News/Read?articleId=A202602110553&t=NN,"엘리시젠, 신약개발 전문가 최진국 박사 영입...'전략실' 신설","미국 UCLA 데이비드 게펜 의과대학과 글로벌 제약사 바이오젠(Biogen)에서 유전자치료 및 중추신경계(CNS) 질환 연구를 중심으로 15년 이상 연구개발 및 조직 리더십 경험을 쌓아왔다. 특히, 바이오젠 재직 시절... ",local,10,바이오젠,,,0.1827334036903366,,1.0,0.1827334036903366,0.7548200211071009,False
2026-02-12,Client,2026-02-09 06:00:00,Naver News,http://www.bosa.co.kr/news/articleView.html?idxno=2269060,[다국적제약 우리 부서가 뛴다]한국오가논 마이 프로페시아 팀,"남성형 탈모 치료는 약을 복용하는 것만으로 끝나지 않는다. 모발의 성장 주기는 수개월 단위로 이어지기 때문에 환자들은 치료 초기에 효과를 체감하기까지 불안과 의문을 느끼는 경우가 많다. 장기 복용이 필요한 치료 특성상, 치료를 꾸준히 이어갈 수 있도록 돕는 보조적 관리 수단의 필요성도 꾸준히 제기돼 왔다.이러한 문제의식에서 출발한 한국오가논 ‘마이 프로페시아’ 팀은 2023년 10월, 남성형 탈모 환자의 치료 관리를 지원하는 애플리케이션 ‘마이 프로페시아(My Propecia)’를 전 세계 최초로 국.",local,10,오가논,,,0.18272246774871898,,1.0,0.18272246774871898,0.7548167403246157,False
2026-02-12,Client,2026-02-12 09:46:00,Naver News,https://www.widedaily.com/news/articleView.html?idxno=288737,"""약효 오래 지속""…'원샷' 유전자 치료제 베팅 제약사들",환자 몸속에 투여된 정상 유전자가 단백질 생산공장 역할을 하는 '유전자 치료제' 개발에 국내외 기업들이 뛰어들고 있다. 한 번 투여로 장기간 효과를 내는 '원샷 치료제' 개발을 목표로 하는 곳도 많다.12일 제약바이오업계에 따르면 비만치료제로 유명한 미국.,local,10,애브비,,,0.18272246774871898,,1.0,0.18272246774871898,0.7548167403246157,False
2026-02-12,Client,2026-02-12 07:56:00,Naver News,http://www.bosa.co.kr/news/articleView.html?idxno=2269804,"제형·포장·패키지 변경 잇따른 제약사 ""왜?'","최근 제약사들이 제형과 포장, 패키지 변경을 잇따라 단행하면서 의료현장과 유통업계가 주목하고 있다. 단순한 외형 수정이 아니라 생산 공정 개선과 품질 강화, 공급 안정성 확보라는 전략적 의미가 담겨 있어 현장 혼선 최소화에 기여할 것으로 기대된다.11일 관련업계에 따르면 대웅·대한뉴팜·명문·삼일·한독 등이 거래 의약품유통업체, 의료기관에 자사 일부 제품에 대한 제형, 포장, 패키지 변경 공문을 발송했다.이들 제약사들의 이번 조치들은 단순한 외형 수정이 아니라 생산 공정 개선, 품질 강화, 현장 혼선.",local,10,머크,,,0.18267061073433952,,1.0,0.18267061073433952,0.7548011832203018,False
2026-02-12,Client,2026-02-12 10:48:00,Naver News,https://www.lcnews.co.kr/news/articleView.html?idxno=123802,[라이센스 제약·헬스 PICK] 정관장·한독제석재단·시지바이오,"라이센스뉴스 = 최은경 기자 | 12일 정관장은 설 명절을 맞아 홀로 계신 어르신들의 건강한 새해를 응원하는 ‘건강이 복이다’ 효(孝)배달 캠페인을 진행하며, 한독제석재단이 11일 서울 마곡에 위치한 한독퓨처콤플렉스 이노베이션홀에서 '제19회 한독제석재단 장학금 및 연구지원금 수여식'을 열고 의대, 약대생과 남북보건의료교육재단 장학생 총 13명, 의약학 교수 총 2명에게 총 1억 5천만원의 장학금과 연구지원금을 전달했다. 시지바이오는 프랑스 파리에서 열린 세계 최대 규모의 미용성형학회 ‘임카스 월드 콩그레스 2026(IMCAS Wo.",local,10,한독,,,0.18262826244324393,,1.0,0.18262826244324393,0.7547884787329732,False
2026-02-12,Client,2026-02-12 15:45:00,Naver News,https://www.mt.co.kr/thebio/2026/02/13/2026021215310126944,주요 제약사 잇따라 호실적…'K-신약'이 효자 - 머니투데이,"유한양행은 지난해 최대 매출액 2조1866억원과 영업이익 1044억원을 기록하며 전년 대비 각각 5.7%, 90.2% 증가했다. 미국과 유럽 진출에 성공한 비소세포폐암 신약 렉라자의 기술료 유입과 약품 판매 증가가 실적을 견인했다.",local,10,노바티스,,,0.18257872773707715,,1.0,0.18257872773707715,0.7547736183211231,False
2026-02-12,BD,2026-02-08 17:44:00,Naver News,https://www.dt.co.kr/article/12045503?ref=naver,제약사 대세 투자처는 어디?…반려동물·디지털헬스케어에 시선,"최근 국내 전통제약사들이 반려동물, 디지털헬스케어 사업 분야에 투자를 확대하며 신규 ‘캐시카우’ 만들기에 집중하고 있다. 반려동물 사업은 직접투자 형식이, 디지털헬스케어 분야는 기술력 있는 기업에 투자해 협업구조를 구축하는 방식이 대세다. 8일 제약업계에 따르면 유유.",local,8,애보트,,,0.2837887712021538,,0.8,0.2837887712021538,0.645136631360646,True
2026-02-12,BD,2026-02-13 03:26:00,Naver News,https://www.apnews.kr/news/articleView.html?idxno=3045838,태광산업 “동성제약 채권자 압박 억측…‘감자 없는 상생’이 본질”,"동성제약 인수를 추진 중인 태광산업·유암코 컨소시엄이 일각에서 제기된 ‘상거래 채권자 대상 거래 단절 압박’ 논란에 대해 “인수 주체의 진의를 왜곡한 무책임한 발언이자, 아무런 근거 없는 억측 주장”이라고 일축했다. 태광산업은 12일 입장문을 통해 ""컨소시엄은 모든 이해 관계인의 보호와 신뢰 회복을 경영의 최우선 가치로 삼을 것”이라며, 대주주 측이 제기한 주장에 선을 그었다. 태광산업은 “회생 기업의 경영 정상화에서 가장 중요한 자산은 수십 년간 쌓아온 영업망과 상거래 채권자들과의 파트너십”이라며, “.",local,8,인수,,,0.27997812212290646,,0.8,0.27997812212290646,0.6439934366368719,True
2026-02-12,BD,2026-02-11 11:42:00,Naver News,http://www.newsmp.com/news/articleView.html?idxno=251590,"GSK 싱그릭스, 자가면역질환 환자에서 안전성 확인","GSK의 재조합 대상포진 백신 싱그릭스가 자가면역질환 환자에게도 안전하다는 연구 결과가 보고됐다.자가면역질환자 중 비접종자와 비교해 악화 위험에 차이가 없었으며, 자가면역질환이 없는 사람과의 비교에서는 이상반응에 차이가 없었다는 것.최근 The Lancet Rheumatology에는 브라질의 2차 의료기관에서 싱그릭스가 류마티스성 자가면역질환 환자에 미치는 영향을 평가한 임상 4상 결과가 게재됐다.연구는 2023년 5월부터 2024년 11월까지 류마티스성 자가면역질환이 있는 환자 1192명을 대상으로 싱그릭스군과 위약군.",local,8,GSK,,,0.2737525259987436,,0.8,0.2737525259987436,0.642125757799623,True
2026-02-12,BD,2026-02-12 21:38:00,Naver News,http://www.lawissue.co.kr/view.php?ud=202602122135556123204ead0791_12,"굿닥, 설 연휴 비대면진료 및 병의원 정보 제공","병원 진료 접수·예약 및 비대면 진료 플랫폼 굿닥이 설 연휴 기간 비대면진료 서비스를 운영하고, 연휴 중 진료 가능한 전국 병의원 정보를 제공한다고 12일 밝혔다.굿닥은 초진과 재진 구분 없이 누구나 비대면진료 서비스를 이용할 수 있도록 지원한다. 이용자는 앱에서 증상과 의료진을 선택한.",local,8,제휴,,,0.2652998438682778,,0.8,0.2652998438682778,0.6395899531604833,True
2026-02-12,BD,2026-02-12 06:02:00,Naver News,https://www.yakup.com/news/index.html?mode=view&cat=16&nid=323236,[약업신문]모더나 인플루엔자 백신 허가신청 FDA 반려..왜?,미국 매사추세츠州 캠브리지에 소재한 차세대 전령 RNA(mRNA) 기반 치료제‧백신 개발 전문 생명공학기업 모더나 테라퓨틱스社는 자사의 계절성 인플루엔자 백신 후보물질 ‘mRNA-1010’의 허가신청 건과 관련...,local,8,생물학적제제,,,0.26401653684154464,,0.8,0.26401653684154464,0.6392049610524633,False
2026-02-12,BD,2026-02-12 09:12:00,Naver News,https://www.koreahealthlog.com/news/articleView.html?idxno=55853,아이 얼굴에 나타난 '나비 모양 발진'…전신홍반루푸스 신호탄,"아이 얼굴에 갑자기 나비 모양의 발진이 생기고, 이 발진이 햇볕을 볼 때 더 심해지는 양상을 보일 때 의심해봐야 하는 질환이 있다. 우리 몸의 면역시스템이 자기 자신을 공격하는 자가면역질환 '전신홍반루푸스'가 그것이다. 서울대병원 소아청소년과 김성헌 교수는 '서울대병원tv'에서 ""전신홍반루푸스는 피부, 관절, 신장, 심장, 뇌 등 온몸 곳곳에 염증이 생길 수 있다""며 ""전신홍반루푸스의 가장 대표적인 증상이 얼굴에 나타나는 나비 모양의 발진""이라고 말했다.",local,8,생물학적제제,,,0.26324662525804865,,0.8,0.26324662525804865,0.6389739875774145,False
2026-02-12,BD,2026-02-12 18:38:00,Naver News,https://www.mediawatch.kr/news/article.html?no=258713,"[인싸잇] [데스크 칼럼] 일본의 약가율, 한국 제네릭 약가 인하의 명분이 될 수 있나","인싸잇=한민철 편집국장 ｜ “정부가 제약사 상황을 몰라도 너무 모르는 것 같습니다. 저희 같은 중소형 제약사는 제네릭 제품이 매출을 책임지고 있습니다. 제네릭을 다들 복사약이라고 쉽게 말하지만, 제품을 개발하고 출시하기까지 수천억에 많게는 조 단위의 투자 비용이 듭니다. 제네릭 출시에 성공하면 그나마 회사가 이익을 내고 재투자할 여력이 생깁니다.",local,8,특허만료,,,0.26324662525804865,,0.8,0.26324662525804865,0.6389739875774145,False
2026-02-12,BD,2026-02-13 06:02:00,Naver News,https://www.dailypharm.com/user/news/335729?REFERER=NP,"[데일리팜]제약사 20곳 모였지만…복지부, 약가개편 수정 요구 외면하나",제네릭 약가 인하와 혁신형제약사 약가우대를 핵심으로 한 약가제도 개편안 시행을 준비중인 보건복지부가 12일 한국제약바이오협회에서 국내 제약사 20여곳을 만나 의견 청취에 나선 것으로 확인됐다. 복지부가 14년만의 큰 폭 약가제도 개편을 앞두고 제약협회와 다수 제약사를 한꺼번에 직접 만나 의견을 수렴한 것은 사실상 이번이 처음이다. 그러나 이날 복지부는 2월 건강보험정책….,local,8,제네릭,,,0.26324662525804865,,0.8,0.26324662525804865,0.6389739875774145,False
2026-02-12,BD,2026-02-12 12:10:00,Naver News,https://www.hitnews.co.kr/news/articleView.html?idxno=73833,"'대체 불가' 표시 유도할까, 약국과 친해질까? CSO, 영업전략 고민 중","약국의 의약품 대체조제 사후통보 간소화가 이달 2일부터 본격 시행된 가운데 의약품 판촉대행(CSO) 업체들 사이에서 기존과 다른 움직임이 감지된다. ①대체조제 불가를 유도하기 위한 영업과 ②처방대로 약국 조제를 유지하기 위한 액션이 더 강해지는데 따른 것이다. 약국가 사이에서 예상보다 이른 시간 내 대체조제율이 높아지기 때문이라는 분석도 나온다.최근 약국가, 제약업계, CSO업계 관계자들에 따르면 2일 사후통보 간소화 이후 CSO 영업사원들은 대체조제에 대응하기 위한 방안 찾기에 주력하고 있다.국내 한 CSO는 대체조제 사후통보 간.",local,8,CSO,,,0.2553325051087471,,0.8,0.2553325051087471,0.636599751532624,False
2026-02-12,BD,2026-02-13 06:02:00,Naver News,https://www.yakup.com/news/index.html?mode=view&cat=12&nid=323310,"[약업신문]제네릭 수익,신약 개발 젖줄..일방적 약가 인하,생산 포기-건강권 위협","©약업신문=김홍식 기자정부가 건강보험 재정 건전성을 이유로 강력한 약가 인하 드라이브를 걸고 있는 가운데, 제약바이오 업계가 한국 산업의 특수성을 무시한 처사라며 거세게 반발하고 나섰다.업계...",local,8,제네릭,,,0.24838544556545816,,0.8,0.24838544556545816,0.6345156336696374,False
2026-02-12,BD,2026-02-12 17:23:00,Naver News,https://news.bizwatch.co.kr/article/healthcare/2026/02/12/0042,"제약바이오협회 ""약가인하, 한국 제약산업 고려 부족""",정부가 추진 중인 약가제도 개편안을 두고 제약산업의 지속가능성을 함께 고려해야 한다는 목소리가 커지고 있다. 약가 인하에 초점을 맞춘 제도 개편이 제네릭 산업 기반을 약화시키면 신약 개발 역량과 의약품 공급 안...,local,8,특허만료,,,0.24461682935133752,,0.8,0.24461682935133752,0.6333850488054011,False
2026-02-12,BD,2026-02-12 06:56:00,Naver News,http://www.newsmp.com/news/articleView.html?idxno=251614,"FDA, 모더나 mRNA 독감 백신 허가 심사 거부",미국 식품의약국(FDA)이 모더나의 mRNA(메신저리보핵산) 인플루엔자(독감) 백신 승인 심사를 거부했다.모더나는 FDA 산하 생물의약품 평가연구센터(CBER)로부터 인플루엔자 백신 후보물질 mRNA-1010에 대한 생물학적제제 허가신청서(BLA) 심사를 개시하지 않겠다는 통보와 함께 접수 거부 서한을 수령했다고 10일 밝혔다.해당 신청서의 신속한 심사를 위해 모더나는 우선 심사 바우처를 사용한 상태였다.CBER은 서한에서 표준 용량 계절성 인플루엔자 백신을 비교군으로 선택한 점을 허가 신청서 심사를 거부한 유일한 사유.,local,8,생물학적제제,,,0.24182048059314393,,0.8,0.24182048059314393,0.6325461441779431,False
2026-02-12,BD,2026-02-13 06:12:00,Naver News,https://www.hitnews.co.kr/news/articleView.html?idxno=73890,가만 놔 두면  알아서 잘하는 국내 제약기업들,"국내 제약기업들은 정부만 가만 놔두면 스스로 잘 할 수 있다. 국내 기업들이 제네릭에만 의존한다는 정부의 지적과 달리 자체 개발 신약을 앞세워 고성장을 이뤄냈다. 정부의 폄훼에 실적으로 반박하는 격이다.국내 제약기업들이 지난해 빼어난 영업실적을 올린 것으로 나타났다. 유한양행 GC녹십자 종근당 광동제약 대웅제약 등 12일 현재 지난해 영업실적(추정치)을 공개한 23곳 상장 기업들의 실적을 집계한 결과 매출은 19조1943억원으로 10.14%성장,했고 영업이익 1조4493억원으로 27.89%, 당기순이익 9438억원으로 111.88%.",local,8,인수,,,0.24066091294204575,,0.8,0.24066091294204575,0.6321982738826136,False
2026-02-12,BD,2026-02-12 22:04:00,Naver News,https://news.bbsi.co.kr/news/articleView.html?idxno=4067273,"경북 백신센터, 식약처 GCLP 인증 획득...백신 산업 핵심 거점 도약","안동에 위치한 경북도 바이오산업연구원 산하 백신상용화기술지원센터가 최근 식약처의 '임상시험검체분석 관리기준', 즉 GCLP 인증을 받았습니다. 이번 인증으로 센터는 임상시험 검체 분석을 독립적으로 수행할 수 있게 됐습니다.이로써 국내 고위험 병원체 대응을 위한 백신 임상시험 인프라가.",local,8,백신,,,0.23873520890365432,,0.8,0.23873520890365432,0.6316205626710962,False
2026-02-12,BD,2026-02-07 06:02:00,Naver News,https://www.dailypharm.com/user/news/335547?REFERER=NP,"[데일리팜]'엑스탄디' 특허만료 임박…아스텔라스, 후속 신약개발 속도",아스텔라스가 전립선암 치료제 '엑스탄디'의 특허 만료를 앞두고 후속 항암 파이프라인 확장에 속도를 내고 있다. 위암·요로상피암에서 혁신신약(First-in-class)을 연이어 출시한 데 이어 이중항체·단백질 분해제·유전자치료제·세포치료제까지 다층적 모달리티로 개발 전략을 넓히는 모습이다. 7일 관련 업계에 따르면 아스텔라스는 최근 신약개발 계획을 통해 엑스탄디(엔잘루타마이드)….,local,8,아스텔라스,,,0.23873520890365432,,0.8,0.23873520890365432,0.6316205626710962,False
2026-02-12,BD,2026-02-10 19:14:00,Naver News,https://www.bloter.net/news/articleView.html?idxno=654019,"[제약사 리포트] 동아에스티, '마진 관리·도입 품목 의존' 과제",동아에스티가 사상 최대 매출을 기록했지만 수익성은 오히려 후퇴했다. 재고자산 정리에 따른 일회성 비용과 도입 품목 중심 매출 구조가 맞물리며 분기 실적이 흔들린 영향이다. 외형 성장과 비용 관리 사이의 균형이 향후 실적 개선의 핵심 과제로 떠오르고 있다. 재고자산 폐기 집중 4분기 '.,local,8,입센,,,0.23873520890365432,,0.8,0.23873520890365432,0.6316205626710962,False
2026-02-12,BD,2026-02-11 09:30:00,Naver News,https://news.bizwatch.co.kr/article/healthcare/2026/02/10/0025,"'플랫폼·후기라운드' 돈 몰린다…AI 신약 '갤럭스', 420억 유치","인공지능(AI) 신약 설계 전문 기업 갤럭스가 420억원 규모의 시리즈B 투자를 유치에 성공했다. 최근 퍼스트바이오테라퓨틱스, 엘리시젠 등 바이오벤처들의 대규모 펀딩 성공 사례가 잇따르면서 기술력으로 성과가 기...",local,8,베링거인겔하임,,,0.23873520890365432,,0.8,0.23873520890365432,0.6316205626710962,False
