date,category,published_date,site_name,url,title,summary,content,region,score_ag,keywords,reward_x,rl_score,lgbm_score,reward_y,final_score,strategic_score,lgbm_component,is_top20
2026-03-27,Client,2026-03-26 06:02:00,Naver News,https://www.dailypharm.com/user/news/336838?REFERER=NP,[데일리팜]담즙성 담관염 신약 가세 활발…글로벌제약 경쟁 구도 요동,"담즙성 담관염(PBC) 치료 영역에 신규 기전 신약이 잇따라 가세하면서 글로벌 제약사 간 경쟁 구도에 변화 조짐이 나타나고 있다. 기존 제한적이던 치료 옵션에 더해 가려움증을 표적으로 한 치료제까지 등장하며 간질환 치료 전략의 확장 가능성이 제기된다. 26일 관련 업계에 따르면 미국 식품의약국(FDA)은 최근 GSK가 개발한 리나보이(Lynavoy, 리네릭시바트)를 PBC 환자의 담즙정체….","담즙성 담관염(PBC) 치료 영역에 신규 기전 신약이 잇따라 가세하면서 글로벌 제약사 간 경쟁 구도에 변화 조짐이 나타나고 있다. 기존 제한적이던 치료 옵션에 더해 가려움증을 표적으로 한 치료제까지 등장하며 간질환 치료 전략의 확장 가능성이 제기된다. 26일 관련 업계에 따르면 미국 식품의약국(FDA)은 최근 GSK가 개발한 리나보이(Lynavoy, 리네릭시바트)를 PBC 환자의 담즙정체…",local,10,입센,,,0,,8.8,7.0,10,False
2026-03-27,BD,2026-03-27 17:22:00,Naver News,http://www.hemophilia.co.kr/news/articleView.html?idxno=41483,"혈우병 B 환자에게 나타난 목의 낭성 종괴, 진단과 수술 관리의 어려움 - 헤모필리아라이프",목에 혹이 생기면 대부분 단순한 염증이나 림프절 문제로 생각하기 쉽다. 그러나 드물게 태어날 때부터 존재하던 기형이 성인이 된 뒤 뒤늦게 발견되는 경우도 있다.,목에 혹이 생기면 대부분 단순한 염증이나 림프절 문제로 생각하기 쉽다. 그러나 드물게 태어날 때부터 존재하던 기형이 성인이 된 뒤 뒤늦게 발견되는 경우도 있다.,local,10,합병,,,0,,8.8,7.0,10,False
2026-03-27,BD,2026-03-27 17:40:00,Naver News,https://www.busan.com/view/busan/view.php?code=2026032717312246849,"제약업계, 제네릭 약가 인하에 ‘유감’…보완책 촉구",정부가 제네릭(복제약) 가격을 오리지널 의약품의 45%로 인하하자 제약업계가 반발하고 있다. 업계는 중동 사태 등 대외 경...,"연합뉴스
				
			정부가 제네릭(복제약) 가격을 오리지널 의약품의 45%로 인하하자 제약업계가 반발하고 있다. 업계는 중동 사태 등 대외 경...",local,10,CSO,,,0,,8.8,7.0,10,False
2026-03-27,BD,2026-03-27 17:58:00,Naver News,http://mbnmoney.mbn.co.kr/news/view?news_no=MM1005799202,14년 만에 약가제도 개편…복제약 가격 낮추고 신약개발 유도,"우리나라 복제약 가격이 주요 선진국에 비해 비싸다는 지적, 그동안 꾸준...","【 앵커멘트 】  우리나라 복제약 가격이 주요 선진국에 비해 비싸다는 지적, 그동안 꾸준...",local,10,제네릭,,,0,,8.8,7.0,10,False
2026-03-27,Client,2026-03-26 06:00:00,Naver News,https://www.bosa.co.kr/news/articleView.html?idxno=3001460,'우파다시티닙' 日서 대동맥염 희귀질환약 지정 - 의학신문,애브비[의학신문·일간보사=정우용 기자] 애브비의 '우파다시티닙'(upadacitinib)이 일본에서 기존 치료로 효과가 충분치 않은 대동맥염(TAK)에 대해 희귀.,애브비[의학신문·일간보사=정우용 기자] 애브비의 '우파다시티닙'(upadacitinib)이 일본에서 기존 치료로 효과가 충분치 않은 대동맥염(TAK)에 대해 희귀,local,10,애브비,,,0,,8.8,7.0,10,False
2026-03-27,Client,2026-03-26 17:42:00,Naver News,http://www.doctorstimes.com/news/articleView.html?idxno=237322,[의료기기업계 소식] 3월 26일,"나노엔텍, 로레알 그룹 ‘셀 바이오프린트’ 첫 출하 나노엔텍(대표 정찬일)은 로레알 그룹과 공동 개발한 최첨단 피부 진단 기기 ‘랑콤 셀 바이오프린트(Lancome Cell BioPrint)’ 글로벌 출하를 시작한다고 26일 밝혔다. 필드테스트1차 물량으로 3월 말부터 장비와 소모품 키트를 순차적으로 출하 예정이다. 이후 필드테스트 경과에 따라 하반기 추가공급을 진행할 계획이다.로레알은 내년 랑콤 셀 바이오프린트 글로벌 정식 론칭을 목표로 실제 현장 투입, 필드테스트를 진행한다는 방침이다.","■ 나노엔텍, 로레알 그룹 ‘셀 바이오프린트’ 첫 출하 나노엔텍(대표 정찬일)은 로레알 그룹과 공동 개발한 최첨단 피부 진단 기기 ‘랑콤 셀 바이오프린트(Lancome Cell BioPrint)’ 글로벌 출하를 시작한다고 26일 밝혔다. 필드테스트1차 물량으로 3월 말부터 장비와 소모품 키트를 순차적으로 출하 예정이다. 이후 필드테스트 경과에 따라 하반기 추가공급을 진행할 계획이다.로레알은 내년 랑콤 셀 바이오프린트 글로벌 정식 론칭을 목표로 실제 현장 투입, 필드테스트를 진행한다는 방침이다. 4월부터 미국, 프랑스, 영국, 한국,",local,10,로레알,,,0,,8.8,7.0,10,False
2026-03-27,BD,2026-03-27 15:18:00,Naver News,https://news.bizwatch.co.kr/article/healthcare/2026/03/27/0027,"제네릭 약가 45% 인하 확정…제약계, 보완책 마련 주문","정부가 제네릭(복제약) 약가를 단계적으로 최대 45%까지 인하하는 내용을 담은 '건강보험 약가제도 개선방안'을 확정한 가운데, 제약바이오 업계는 정책 취지에는 공감하면서도 인하 폭과 시행 여건에 대해서...","정부가 제네릭(복제약) 약가를 단계적으로 최대 45%까지 인하하는 내용을 담은 &#39;건강보험 약가제도 개선방안&#39;을 확정한 가운데, 제약바이오 업계는 정책 취지에는 공감하면서도 인하 폭과 시행 여건에 대해서...",local,10,판촉영업자,,,0,,8.8,7.0,10,False
2026-03-27,Client,2026-03-26 11:37:00,Naver News,https://www.newspim.com/news/view/20260326000563,"나노엔텍, 로레알 '랑콤 셀 바이오프린트' 9개국 첫 출하",나노엔텍이 로레알 그룹과 공동 개발한 피부 진단 기기 '랑콤 셀 바이오프린트(Lancome Cell BioPrint)'의 글로벌 출하를 시작한다.26일 나노엔텍은 필드테스트 1차 물량으로 이달 말부터 장비와 소모품 키트를 순차.,[서울=뉴스핌] 양태훈 기자 = 나노엔텍이 로레알 그룹과 공동 개발한 피부 진단 기기 '랑콤 셀 바이오프린트(Lancome Cell BioPrint)'의 글로벌 출하를 시작한다.26일 나노엔텍은 필드테스트 1차 물량으로 이달 말부터 장비와 소모품 키트를 순차,local,10,로레알,,,0,,8.8,7.0,10,False
2026-03-27,Client,2026-03-25 16:54:00,Naver News,https://www.sisajournal-e.com/news/articleView.html?idxno=420016,"동구바이오 ‘피부과 1위’ 굳히기···동아ST, 아토피 치료제 반격 - 시사저널e",동구바이오제약이 지난해 국내 피부과 치료제 시장 원외처방 1위를 기록한 가운데 2위인 동아에스티는 올해 초부터 아토피 피부염 치.,[시사저널e=이상구 의약전문기자] 동구바이오제약이 지난해 국내 피부과 치료제 시장 원외처방 1위를 기록한 가운데 2위인 동아에스티는 올해 초부터 아토피 피부염 치,local,10,애브비,,,0,,8.8,7.0,10,False
2026-03-27,BD,2026-03-27 17:46:00,Naver News,https://news.mtn.co.kr/news-detail/2026032716383818269,제네릭 약값 8%포인트 인하…비상 걸린 제약바이오업계,"복제약, 제네릭의 약값이 오리지널 의약품 대비 45%로 인하됩니다. 국민 전체 의료비의 20%를 차지하는 약제비를 아껴 건강보험 재정을 확보하는 정책인데요. 당장 매출에서 손해를 떠안아야 하는 제약업계에는 비상이 걸렸습니다. 이수현 기자입니다. [기사내용]14년 만에 약가를 인하하는 대규모 제도 개편이 연내 추진됩니다.보건복지부는 건강보험정책심의위원회, 건정심을 통해 복제 의약품 가격을 원조 의약품 대비 45%로 인하하기로 결정했습니다.","[앵커멘트]복제약, 제네릭의 약값이 오리지널 의약품 대비 45%로 인하됩니다. 국민 전체 의료비의 20%를 차지하는 약제비를 아껴 건강보험 재정을 확보하는 정책인데요. 당장 매출에서 손해를 떠안아야 하는 제약업계에는 비상이 걸렸습니다. 이수현 기자입니다. [기사내용]14년 만에 약가를 인하하는 대규모 제도 개편이 연내 추진됩니다.보건복지부는 건강보험정책심의위원회, 건정심을 통해 복제 의약품 가격을 원조 의약품 대비 45%로 인하하기로 결정했습니다. [이형훈 / 복지부 제2차관 : 국민의 의약품 접근성은 강화되고 약품비 부담은",local,10,제네릭,,,0,,8.8,7.0,10,False
2026-03-27,Client,2026-03-25 05:00:00,Naver News,http://www.mkhealth.co.kr/news/articleView.html?idxno=77988,우리 아이의 '긁는 밤' 줄일 수 있을까…아토피 치료의 진화,"영유아 시기에 시작된 아토피 피부염은 단순한 피부 질환을 넘어 성장과 수면, 삶의 질 전반에 영향을 미친다. 특히 밤마다 이어지는 극심한 가려움으로 아이와 보호자 모두 일상에 어려움을 겪는 경우가 많다. 아토피 피부염은 피부가 건조해지고 가려움과 붉은 발진 등이 나타나는 만성질환이다. 주로 영유아 시기에 발병한다. 긁고 싶은 충동이 들 수 있는데, 긁게 되면 피부가 붓거나 갈라지고, 딱지가 생기거나 각질이 일어날 수 있다.","영유아 시기에 시작된 아토피 피부염은 단순한 피부 질환을 넘어 성장과 수면, 삶의 질 전반에 영향을 미친다. 특히 밤마다 이어지는 극심한 가려움으로 아이와 보호자 모두 일상에 어려움을 겪는 경우가 많다. 아토피 피부염은 피부가 건조해지고 가려움과 붉은 발진 등이 나타나는 만성질환이다. 주로 영유아 시기에 발병한다. 긁고 싶은 충동이 들 수 있는데, 긁게 되면 피부가 붓거나 갈라지고, 딱지가 생기거나 각질이 일어날 수 있다. 경우에 따라 발진 부위에서 맑은 액체가 흘러나오기도 한다.유전적 요인, 약해진 피부 장벽, 면역 체계 이상이",local,10,리제네론,,,0,,8.8,7.0,10,False
2026-03-27,Client,2026-03-26 14:22:00,Naver News,http://www.smedaily.co.kr/news/articleView.html?idxno=354252,"K-바이오 암세포 '타깃' 기술, 세계 3대 암학회 AACR 이목 끈다",내달 17일 열리는 세계 3대 암학회 중 한 곳인 'AACR(American Association for Cancer Research) 2026'에서 암세포'만'을 '타깃'해 공격하는 K-바이오 기업들의 신기술이 주목된다.26일 업계에 따르면 오름테라퓨틱은 이전 AACR에서 새로운 미공개 링커 기술을 발표하겠다고 밝혔다.오름테라퓨틱은 기존 단백질 분해제(TPD) 기술이 가진 부족한 침투력을 ADC 기술로 만회한 'DAC' 기술로 주목을 받고 있다.항체-약물 접합체(ADC)는 항체가 암세포 표면의 특정 항원을 찾아 결합하면 페이로드(.,내달 17일 열리는 세계 3대 암학회 중 한 곳인 'AACR(American Association for Cancer Research) 2026'에서 암세포'만'을 '타깃'해 공격하는 K-바이오 기업들의 신기술이 주목된다.26일 업계에 따르면 오름테라퓨틱은 이전 AACR에서 새로운 미공개 링커 기술을 발표하겠다고 밝혔다.오름테라퓨틱은 기존 단백질 분해제(TPD) 기술이 가진 부족한 침투력을 ADC 기술로 만회한 'DAC' 기술로 주목을 받고 있다.항체-약물 접합체(ADC)는 항체가 암세포 표면의 특정 항원을 찾아 결합하면 페이로드(,local,10,노바티스,,,0,,8.8,7.0,10,False
2026-03-27,Client,2026-03-27 10:14:00,Naver News,https://www.cbci.co.kr/news/articleView.html?idxno=563679,치매 테마주 일제히 약세…유한양행 종근당 하락 네이처셀만 3.51% 상승 ‘이례적 흐름’,"치매 치료제 및 관련 바이오 기업으로 분류되는 이른바 ‘치매 테마주’가 전반적으로 약세 흐름을 보이고 있다. 다만 일부 종목은 개별 이슈에 따른 차별화된 움직임을 나타내며 혼조세 양상을 보이고 있다.27일 오전 현재 기준 주요 치매 관련 종목들의 주가를 살펴보면, 전반적으로 하락 압력이 우세한 흐름이다. 현대약품은 8,780원으로 전일 대비 4.25% 하락했고, 명문제약(-1.69%), 유유제약(-0.92%), 환인제약(-1.35%) 등 다수 종목이 약세권에 머물렀다.특히 바이오 및 신약 개발 기대감이 반영되는 종목들.","[CBC뉴스] 치매 치료제 및 관련 바이오 기업으로 분류되는 이른바 ‘치매 테마주’가 전반적으로 약세 흐름을 보이고 있다. 다만 일부 종목은 개별 이슈에 따른 차별화된 움직임을 나타내며 혼조세 양상을 보이고 있다.27일 오전 현재 기준 주요 치매 관련 종목들의 주가를 살펴보면, 전반적으로 하락 압력이 우세한 흐름이다. 현대약품은 8,780원으로 전일 대비 4.25% 하락했고, 명문제약(-1.69%), 유유제약(-0.92%), 환인제약(-1.35%) 등 다수 종목이 약세권에 머물렀다.특히 바이오 및 신약 개발 기대감이 반영되는 종목들",local,10,현대약품,,,0,,8.8,7.0,10,False
2026-03-27,Client,2026-03-25 06:02:00,Naver News,https://www.dailypharm.com/user/news/336804?REFERER=NP,[데일리팜]렉라자·펙수클루 등 2분기 사용량-약가연동 모니터링,"렉라자와 펙수클루 등 152개 품목이 올해 2분기 사용량-약가연동 협상 모니터링 약제에 포함됐다. 또 타그리소와 럭스터나, 아일리아, 코셀루고 등의 항암제와 희귀질환 치료제 다수가 모니터링 대상이 됐다. 24일 건강보험공단은 ‘2분기 사용량-약가 연동 협상 유형 가·나 모니터링 대상 약제’ 명단을 공개했다. 총 152개 품목이다. 그 중 건선 치료제인 ‘아프레밀라스트’ 성분 제품과….","렉라자와 펙수클루 등 152개 품목이 올해 2분기 사용량-약가연동 협상 모니터링 약제에 포함됐다. 또 타그리소와 럭스터나, 아일리아, 코셀루고 등의 항암제와 희귀질환 치료제 다수가 모니터링 대상이 됐다. 24일 건강보험공단은 ‘2분기 사용량-약가 연동 협상 유형 가·나 모니터링 대상 약제’ 명단을 공개했다. 총 152개 품목이다. 그 중 건선 치료제인 ‘아프레밀라스트’ 성분 제품과…",local,10,아스트라제네카,,,0,,8.8,7.0,10,False
2026-03-27,Client,2026-03-26 15:44:00,Naver News,https://www.etoday.co.kr/news/view/2569759,"나노엔텍, 로레알 그룹 ‘셀 바이오프린트’ 첫 출하⋯9개국서 피부 진단 혁신",(사진제공=나노엔텍)나노엔텍은 로레알 그룹과 공동 개발한 최첨단 피부 진단 기기 ‘랑콤 셀 바이오프린트(Lancome Cell BioPrint)’ 글.,▲나노엔텍 CI. (사진제공=나노엔텍)나노엔텍은 로레알 그룹과 공동 개발한 최첨단 피부 진단 기기 ‘랑콤 셀 바이오프린트(Lancome Cell BioPrint)’ 글,local,10,로레알,,,0,,8.8,7.0,10,False
2026-03-27,Client,2026-03-26 06:02:00,Naver News,http://www.newsmp.com/news/articleView.html?idxno=252329,"병원약사회 환자안전약물관리센터 ""주사 마약류 포장 개선 성과 가시화""","한국병원약사회 환자안전약물관리센터가 주사 마약류 포장 개선을 통해 현장 혼동을 줄이는 성과를 냈다.함량 표기 통일과 개별포장 강화, 동일 성분 간 색상 정비를 공통 개선 방향으로 제시한 뒤 일부 품목은 실제 포장 변경과 표기 보완으로 이어졌다는 전언이다.환자안전약물관리센터 윤정이 센터장(부회장)은 24일 한국병원약사회관에서 센터의 환자안전사고 예방 및 개선활동, 교육ㆍ홍보, 보고 활성화, 정책 대응 현황을 소개했다.환자안전약물관리센터는 의약품 관련 환자안전사고의 오류 분석과 예방 강화를 위해 설립된 조직이다윤 센터장은.","[의약뉴스] 한국병원약사회 환자안전약물관리센터가 주사 마약류 포장 개선을 통해 현장 혼동을 줄이는 성과를 냈다.함량 표기 통일과 개별포장 강화, 동일 성분 간 색상 정비를 공통 개선 방향으로 제시한 뒤 일부 품목은 실제 포장 변경과 표기 보완으로 이어졌다는 전언이다.환자안전약물관리센터 윤정이 센터장(부회장)은 24일 한국병원약사회관에서 센터의 환자안전사고 예방 및 개선활동, 교육ㆍ홍보, 보고 활성화, 정책 대응 현황을 소개했다.환자안전약물관리센터는 의약품 관련 환자안전사고의 오류 분석과 예방 강화를 위해 설립된 조직이다윤 센터장은",local,10,바이엘,,,0,,8.8,7.0,10,False
2026-03-27,BD,2026-03-27 12:04:00,Naver News,https://www.dailypharm.com/user/news/336925?REFERER=NP,[데일리팜]제네릭 약가 단계적 인하...비혁신형 29년 45% 도달,"정부가 비혁신형 제약사를 포함해 기등재 약가인하를 최대 10년에 걸쳐 진행한다. 매년 2%씩 단계적 인하가 적용돼 혁신형과 준혁신형 제약사는 2032년, 비혁신형 제약사는 2029년 산정률 45%에 도달할 예정이다. 또 2013년 이후 등재가 된 품목들은 2030년부터 단계적 인하가 시작된다. 비혁신형은 2033년, 혁신형과 준혁신형은 2036년에 45%로 수렴한다.","정부가 비혁신형 제약사를 포함해 기등재 약가인하를 최대 10년에 걸쳐 진행한다. 매년 2%씩 단계적 인하가 적용돼 혁신형과 준혁신형 제약사는 2032년, 비혁신형 제약사는 2029년 산정률 45%에 도달할 예정이다. 또 2013년 이후 등재가 된 품목들은 2030년부터 단계적 인하가 시작된다. 비혁신형은 2033년, 혁신형과 준혁신형은 2036년에 45%로 수렴한다. 제약업계의 급격한 매출 감소…",local,10,특허만료,,,0,,8.8,7.0,10,False
2026-03-27,BD,2026-03-27 15:44:00,Naver News,https://www.news1.kr/bio/general/6116643,"""제네릭 약가 인하폭 늘려야"" ""재정부담 완화 조치"" 환자단체 반응 엇갈려","중증질환연합회 ""제약업계 이해관계 따진 미온적 조치"" 환자단체연합회 ""재정부담 완화 조치…결과로 이어지길"" 정부가 제네릭(복제약) 약가를 오리지널 약가 대비 53.55%에서 45%로 인하하기로 결정한 데 대해 환자단체들이 엇갈린 반응을 내놨다.한국암환자권익협의회 등 7 ….","중증질환연합회 ""제약업계 이해관계 따진 미온적 조치"" 환자단체연합회 ""재정부담 완화 조치…결과로 이어지길"" 정부가 제네릭(복제약) 약가를 오리지널 약가 대비 53.55%에서 45%로 인하하기로 결정한 데 대해 환자단체들이 엇갈린 반응을 내놨다.한국암환자권익협의회 등 7 …",local,10,약가,,,0,,8.8,7.0,10,False
2026-03-27,BD,2026-03-27 16:56:00,Naver News,https://www.eroun.net/news/articleView.html?idxno=76690,"영주적십자병원, 취약계층 무료 예방접종 지원… 공공의료 안전망 강화",이로운넷 = 이지훈 기자 경북 영주적십자병원이 취약계층의 건강권 보장을 위한 예방접종 지원사업에 나서며 지역 공공의료 역할을 강화하고 있다.영주적십자병원(병원장 장석)은 대한적십자사 의료원을 통해 한국수출입은행 후원 배분금을 활용한 ‘취약계층 예방접종 지원사업’ 추진을 위해 경북 북부.,이로운넷 = 이지훈 기자 경북 영주적십자병원이 취약계층의 건강권 보장을 위한 예방접종 지원사업에 나서며 지역 공공의료 역할을 강화하고 있다.영주적십자병원(병원장 장석)은 대한적십자사 의료원을 통해 한국수출입은행 후원 배분금을 활용한 ‘취약계층 예방접종 지원사업’ 추진을 위해 경북 북부,local,10,합병,,,0,,8.8,7.0,10,False
2026-03-27,BD,2026-03-27 07:42:00,Naver News,https://www.medicopharma.co.kr/news/articleView.html?idxno=67553,뇌혈관장벽 뚫는 첫 신약 탄생…BBB 셔틀 시대 열렸다,미국 드날리 테라퓨틱스(Denali Therapeutics)의 헌터증후군 치료제 아블라야(Avlayah)가 FDA 가속승인을 받으며 뇌혈관장벽(BBB)을 통과하는 최초의 바이오의약품이 탄생했다. 그동안 난공불락으로 여겨졌던 BBB를 약물로 넘나드는 새로운.,[메디코파마뉴스=정재노 기자] 미국 드날리 테라퓨틱스(Denali Therapeutics)의 헌터증후군 치료제 아블라야(Avlayah)가 FDA 가속승인을 받으며 뇌혈관장벽(BBB)을 통과하는 최초의 바이오의약품이 탄생했다. 그동안 난공불락으로 여겨졌던 BBB를 약물로 넘나드는 새로운,local,10,사노피,,,0,,8.8,7.0,10,False
2026-03-27,BD,2026-03-27 12:40:00,Naver News,https://www.medicaltimes.com/Main/News/NewsView.html?ID=1167963&ref=naverpc,[메디칼타임즈] 약가인하 45% 결정되자 곳곳서 필수의약품 품귀 우려,"국내 제약산업의 수익 기반을 뒤흔들 제네릭 약가 인하가 기정사실화되면서, 의료계를 중심으로 필수의약품 공급 불안에 대한 우려가 커지고 있다. 이런 가운데 국내에서 생산된 필수의약품을 국가가 우선 구매할 수 있도록 하는 법안이 국회에서 발의돼 눈길을 끈다.국회 보건복지위원회 한지아 의원(국민의힘)은 지난 26일, 국가·지방자치단체가 의약품 비축사업이나 예방접종사업을 추진할 때 국내 생산 필수의약품을 우선적으로 구매할 수 있도록 하는 '제약산업 육성 및 지원에 관한 특별법' 일부개정법률안을 대표발의했다.복지부가 건정심에서 제네릭 약가 45% 결정되면서 의료계 필수의약품 품위 우려가 높은 가운데 한지아 의원의 법안이 관심이다. 여기에 보건복지부가 건강보험정책심의위원회(건정심)를 열고 제네릭 약가 산정률을 오리지널의 45% 수준으로 최종 확정하면서 한 의원의 제약산업 특별법 개정안에 관심이 더 쏠리고 있다.","[메디칼타임즈=이지현 기자] 국내 제약산업의 수익 기반을 뒤흔들 제네릭 약가 인하가 기정사실화되면서, 의료계를 중심으로 필수의약품 공급 불안에 대한 우려가 커지고 있다. 이런 가운데 국내에서 생산된 필수의약품을 국가가 우선 구매할 수 있도록 하는 법안이 국회에서 발의돼 눈길을 끈다.국회 보건복지위원회 한지아 의원(국민의힘)은 지난 26일, 국가·지방자치단체가 의약품 비축사업이나 예방접종사업을 추진할 때 국내 생산 필수의약품을 우선적으로 구매할 수 있도록 하는 '제약산업 육성 및 지원에 관한 특별법' 일부개정법률안을 대표발의했다.복지부가 건정심에서 제네릭 약가 45% 결정되면서 의료계 필수의약품 품위 우려가 높은 가운데 한지아 의원의 법안이 관심이다. 여기에 보건복지부가 건강보험정책심의위원회(건정심)를 열고 제네릭 약가 산정률을 오리지널의 45% 수준으로 최종 확정하면서 한 의원의 제약산업 특별법 개정안에 관심이 더 쏠리고 있다.  의료계가 가장 우려하는 것은 일선 제약사들이 수익성 악화에 따른 필수의약품 생산을 포기하는 것이다.항생제, 수액제, 마취제 등 대체재 없이 임상 현장에서 반드시 필요한 의약품 상당수가 이미 낮은 마진으로 유지되고 있는 상황에서, 추가적인 약가 인하가 현실화되면 제약사들이 채산성을 이유로 생산을 중단하거나 줄일 가능성이 높기 때문이다.의료 현장에서는",local,10,품귀,,,0,,8.8,7.0,10,False
2026-03-27,BD,2026-03-27 17:18:00,Naver News,http://www.globalepic.co.kr/view.php?ud=2026032716473288269aeda69934_29,"항암치료 후 뇌출혈 진단비 분쟁, 코드 기준으로 거절되는 현실","보험기간 중 뇌출혈이 발생하면 당연히 진단비를 받을 수 있다고 생각하기 쉽다. 그러나 실제 보험금 청구 현장에서는 전혀 다른 결과가 발생하기도 한다. 특히 항암치료 이후 뇌종양에서 발생한 뇌출혈의 경우, 보험회사가 지급을 거절하는 사례가 반복되고 있어 주의가 필요하다.소혜림 변호사는 “.","보험기간 중 뇌출혈이 발생하면 당연히 진단비를 받을 수 있다고 생각하기 쉽다. 그러나 실제 보험금 청구 현장에서는 전혀 다른 결과가 발생하기도 한다. 특히 항암치료 이후 뇌종양에서 발생한 뇌출혈의 경우, 보험회사가 지급을 거절하는 사례가 반복되고 있어 주의가 필요하다.소혜림 변호사는 “",local,10,합병,,,0,,8.8,7.0,10,False
