date,category,published_date,site_name,url,title,summary,content,region,score_ag,keywords,reward_x,rl_score,lgbm_score,reward_y,final_score,strategic_score,lgbm_component,is_top20
2026-03-27,BD,2026-03-27 16:06:00,Naver News,http://www.bokuennews.com/news/article.html?no=275852,"제약업계, '16% 약가 인하' 결정에 유감… ""보건안보·산업 생태계 위축...","업계는 단순한 약가 인하를 넘어 의약품판촉영업자(CSO) 등 유통 구조 개선과 제네릭 활성화 방안 등 실질적인 산업 육성 대책이 논의되기를 기대하고 있다. 비대위는 ""정부는 이번 개편안이 산업계에 미칠 영향을 면밀히... ","업계는 단순한 약가 인하를 넘어 의약품판촉영업자(CSO) 등 유통 구조 개선과 제네릭 활성화 방안 등 실질적인 산업 육성 대책이 논의되기를 기대하고 있다. 비대위는 ""정부는 이번 개편안이 산업계에 미칠 영향을 면밀히... ",local,10,CSO,,,0,,10.0,10.0,10,False
2026-03-27,Client,2026-03-27 11:36:00,Naver News,https://www.medipana.com/news/articleView.html?idxno=408875,"'블린사이토', ALL 1차 공고요법 급여 확대 분수령…4월 약평위 촉각 - 메디파나뉴스",﻿암젠코리아의 BiTE(Bispecific T cell Engager) 플랫폼 활용 급성림프모구성백혈병(이하 ALL) 치료제 '블.,[메디파나뉴스 = 조해진 기자] ﻿암젠코리아의 BiTE(Bispecific T cell Engager) 플랫폼 활용 급성림프모구성백혈병(이하 ALL) 치료제 '블,local,10,암젠,,,0,,10.0,10.0,10,False
2026-03-27,Client,2026-03-23 12:18:00,Naver News,https://www.kpanews.co.kr/news/articleView.html?idxno=531520,"알파시그마 ‘리나보이’, GSK서 들여오자마자 FDA 조기 승인 - 약사공론",이탈리아 제약사 알파시그마(Alfasigma)가 글로벌 제약사 GSK로부터 최근 라이선스 도입한 희귀 간질환 치료제가 미국 식품의약국(FDA)으로부터 예정보다 앞.,이탈리아 제약사 알파시그마(Alfasigma)가 글로벌 제약사 GSK로부터 최근 라이선스 도입한 희귀 간질환 치료제가 미국 식품의약국(FDA)으로부터 예정보다 앞,local,10,입센,,,0,,10.0,10.0,10,False
2026-03-27,BD,2026-03-27 16:00:00,Naver News,https://www.news1.kr/bio/pharmaceutical-bio/6116683,"동구바이오제약, 에이치투메디와 '라라닥터' 국내 독점 유통 계약",동구바이오제약(006620)은 최근 서울 강남구 에이치투메디 본사에서 메디컬 에스테틱 신제품 '라라닥터'(LHALA Doctor)의 국내 독점 유통 계약 체결식을 ….,동구바이오제약(006620)은 최근 서울 강남구 에이치투메디 본사에서 메디컬 에스테틱 신제품 '라라닥터'(LHALA Doctor)의 국내 독점 유통 계약 체결식을 …,local,10,신제품,,,0,,10.0,10.0,10,False
2026-03-27,BD,2026-03-27 17:54:00,Naver News,https://www.newscj.com/news/articleView.html?idxno=3389146,"시지바이오, KIMES 2026서 종합 의료기기 포트폴리오 공개","시지바이오는 최근 서울 삼성동 코엑스에서 열린 ‘제41회 국제의료기기·병원설비전시회(KIMES 2026)’에 참가해 미용성형, 상처치료, 뼈·척추, 내외과 분야 제품을 선보였다고 27일 밝혔다.아울러 5개국 파트너사와 총 53억원 규모의 해외 공급 계약을 체결.","[천지일보=홍보영 기자] 시지바이오는 최근 서울 삼성동 코엑스에서 열린 ‘제41회 국제의료기기·병원설비전시회(KIMES 2026)’에 참가해 미용성형, 상처치료, 뼈·척추, 내외과 분야 제품을 선보였다고 27일 밝혔다.아울러 5개국 파트너사와 총 53억원 규모의 해외 공급 계약을 체결",local,10,계약,,,0,,10.0,10.0,10,False
2026-03-27,BD,2026-03-24 10:10:00,Naver News,https://dealsite.co.kr/articles/158950,"[제약+] 대웅제약, 티알과 디지털 기반 폐기능검사기 공급계약 체결 外 - 딜사이트","대웅제약은 티알과 디지털 폐기능검사기 '더스피로킷' 공급 계약을 체결하고 전국 병·의원 및 검진센터 영업을 강화한다고 24일 밝혔다. 티알은 개발·제조를, 대웅제약은 유통·마케팅을 맡는다. 이번 협력은 의료기기 기술과 제약사 영업망을 결합한 전략적 파트너십으로 디지털 헬스케어 사업 경쟁력 강화가 기대된다. 특히 2026년부터 국가건강검진에 폐기능검사가 도입.","대웅제약은 티알과 디지털 폐기능검사기 '더스피로킷' 공급 계약을 체결하고 전국 병·의원 및 검진센터 영업을 강화한다고 24일 밝혔다. 티알은 개발·제조를, 대웅제약은 유통·마케팅을 맡는다. 이번 협력은 의료기기 기술과 제약사 영업망을 결합한 전략적 파트너십으로 디지털 헬스케어 사업 경쟁력 강화가 기대된다. 특히 2026년부터 국가건강검진에 폐기능검사가 도입",local,10,다이이찌산쿄,,,0,,10.0,10.0,10,False
2026-03-27,BD,2026-03-27 12:08:00,Naver News,https://www.yakup.com/news/index.html?mode=view&cat=16&nid=325281,[약업신문]중증 백혈구 접착 결핍증 유전자 치료제 나온다,FDA가 중증 백혈구 접착 결핍증 1형(LAD-Ⅰ) 환자들을 위한 최초의 유전자 치료제를 26일 가속승인했다.(accelerated approval)미국 뉴저지州 크랜버리에 본사를 둔 희귀 유전자 치료제 개발 전문 생명공학기업 로...,FDA가 중증 백혈구 접착 결핍증 1형(LAD-Ⅰ) 환자들을 위한 최초의 유전자 치료제를 26일 가속승인했다.(accelerated approval)미국 뉴저지州 크랜버리에 본사를 둔 희귀 유전자 치료제 개발 전문 생명공학기업 로...,local,10,생물학적제제,,,0,,10.0,10.0,10,False
2026-03-27,BD,2026-03-27 14:52:00,Naver News,https://www.straightnews.co.kr/news/articleView.html?idxno=298701,"인제대 물류특성화대학 사업단-㈜현성컴퍼니, 스마트물류 인재 양성 협약 체결","인제대학교 물류특성화대학 사업단은 27일 의약품 유통 전문기업인 ㈜현성컴퍼니와 스마트물류 인재 양성 및 연구개발 역량 강화를 위한 업무협약을 체결했다.이번 협약은 대학의 교육 인프라와 기업의 현장 실무력을 결합해 물류산업 전문 인력을 양성하고, 산학연 협력 네트워크를 공고히 하기 위해 추진됐다.㈜현성컴퍼니는 부산·경남 지역을 기반으로 급성장 중인 의약품 전문 물류·유통 기업이다.양 기관은 이번 협약에 따라 산업 현장의 경험과 기술력을 교육과정에 접목하고 경쟁력 있는 실무형 인재를 육성하는 데 적극 협력하기로 했다.김민재 물류특성화대.","인제대학교 물류특성화대학 사업단은 27일 의약품 유통 전문기업인 ㈜현성컴퍼니와 스마트물류 인재 양성 및 연구개발 역량 강화를 위한 업무협약을 체결했다.이번 협약은 대학의 교육 인프라와 기업의 현장 실무력을 결합해 물류산업 전문 인력을 양성하고, 산학연 협력 네트워크를 공고히 하기 위해 추진됐다.㈜현성컴퍼니는 부산·경남 지역을 기반으로 급성장 중인 의약품 전문 물류·유통 기업이다.양 기관은 이번 협약에 따라 산업 현장의 경험과 기술력을 교육과정에 접목하고 경쟁력 있는 실무형 인재를 육성하는 데 적극 협력하기로 했다.김민재 물류특성화대",local,10,콜드체인,,,0,,10.0,10.0,10,False
2026-03-27,BD,2026-03-25 06:00:00,Naver News,https://www.apsk.co.kr/news/articleView.html?idxno=538943,엑스탄디 정제 급여 등재…제네릭 공세 속 '방어 카드’ 될까 - 메디팜스투데이,"아스텔라스제약의 전립선암 치료제 '엑스탄디(성분명 엔잘루타마이드)'가 제네릭 공세가 본격화되는 가운데, 정제 제형의 급여 등재라는 새로운 변수를 맞았다.오는 6월.","아스텔라스제약의 전립선암 치료제 '엑스탄디(성분명 엔잘루타마이드)'가 제네릭 공세가 본격화되는 가운데, 정제 제형의 급여 등재라는 새로운 변수를 맞았다.오는 6월",local,10,아스텔라스,,,0,,10.0,10.0,10,False
2026-03-27,BD,2026-03-26 15:15:00,Naver News,https://www.joongang.co.kr/article/25415044,"휴온스-사노피, 백신 5종 유통 계약 | 중앙일보","휴온스그룹 휴온스가 글로벌 바이오제약 기업 사노피의 한국법인(이하 사노피)과 손잡고 백신 시장에 진출한다. 휴온스는 금번 계약을 통해 오는 4월 1일부터 ▲인플루엔자 백신 ‘박씨그리프(standard-dose)’ 및 ‘에플루엘다(high-dose)’ 그리고 성인 대상 접종 영역에서의 ▲디프테리아/파상풍/백일해 백신 ‘아다셀’ ▲A형간염 백신 ‘아박심160’ ▲수막구균 백신 ’멘쿼드피’ 등 총 5종의 백신에 대한 국내 유통 및 프로모션을 담당한다. 휴온스 송수영 대표는 ""전 세계 백신 분야에서 과학적 신뢰성과 품질로 인정받는 사노피와의 협력은 휴온스가 글로벌 수준의 공중보건 파트너로 성장하는 중요한 전환점이 될 것이다""며 ""사노피의 혁신 솔루션과 휴온스의 의약품 영업 노하우를 결합해 국내 백신 시장의 새로운 기준을 제시해 나가겠다""고 말했다.","휴온스그룹 휴온스가 글로벌 바이오제약 기업 사노피의 한국법인(이하 사노피)과 손잡고 백신 시장에 진출한다. 휴온스는 금번 계약을 통해 오는 4월 1일부터 ▲인플루엔자 백신 ‘박씨그리프(standard-dose)’ 및 ‘에플루엘다(high-dose)’ 그리고 성인 대상 접종 영역에서의 ▲디프테리아/파상풍/백일해 백신 ‘아다셀’ ▲A형간염 백신 ‘아박심160’ ▲수막구균 백신 ’멘쿼드피’ 등 총 5종의 백신에 대한 국내 유통 및 프로모션을 담당한다. 휴온스 송수영 대표는 ""전 세계 백신 분야에서 과학적 신뢰성과 품질로 인정받는 사노피와의 협력은 휴온스가 글로벌 수준의 공중보건 파트너로 성장하는 중요한 전환점이 될 것이다""며 ""사노피의 혁신 솔루션과 휴온스의 의약품 영업 노하우를 결합해 국내 백신 시장의 새로운 기준을 제시해 나가겠다""고 말했다.",local,10,사노피,,,0,,10.0,10.0,10,False
2026-03-27,BD,2026-03-27 17:48:00,Naver News,http://www.newsmp.com/news/articleView.html?idxno=252375,"약가 제도 개선방안, 국내사 ‘우려’ 외자사 ‘기대’","건강보험정책심의위원회가 보건복지부의 약가제도 개선방안을 최종 의결한 가운데 국내 제약ㆍ바이오 업체들이 중심이 된 ‘산업발전을 위한 약가제도 개편 비상대책위원회’와 다국적 제약사 국내 법인들의 대표 단체인 ‘한국글로벌의약산업협회(KRPIA)’ 상반된 평가를 내놨다.앞서 복지부는 26일, 건강보험정책심의위원회에서 특허만료 의약품 미 제네릭 의약품의 급여 상한액을 특허만료 전 상한액의 53.55%에서 45%로, 다시 말해 현재 급여 상한액에서 약 16% 더 낮추겠다는 내용의 약가제도 개선방안을 최종 확정했다고 밝혔다.약가제도.","[의약뉴스] 건강보험정책심의위원회가 보건복지부의 약가제도 개선방안을 최종 의결한 가운데 국내 제약ㆍ바이오 업체들이 중심이 된 ‘산업발전을 위한 약가제도 개편 비상대책위원회’와 다국적 제약사 국내 법인들의 대표 단체인 ‘한국글로벌의약산업협회(KRPIA)’ 상반된 평가를 내놨다.앞서 복지부는 26일, 건강보험정책심의위원회에서 특허만료 의약품 미 제네릭 의약품의 급여 상한액을 특허만료 전 상한액의 53.55%에서 45%로, 다시 말해 현재 급여 상한액에서 약 16% 더 낮추겠다는 내용의 약가제도 개선방안을 최종 확정했다고 밝혔다.약가제도",local,10,CSO,,,0,,10.0,10.0,10,False
2026-03-27,BD,2026-03-27 10:46:00,Naver News,http://www.press9.kr/news/articleView.html?idxno=74170,"[Generic Trend]'자카비' 노리는 대웅제약·종근당, 품목허가만 남았다","노바티스의 항암제 '자카비(성분명 룩소리티닙)'의 제네릭 조기 출시에 도전한 대웅제약과 종근당이 특허 허들을 넘는 데 성공했다. 품목허가만 남게 된 것으로, 향후 우선판매품목허가 경쟁을 주목해야 할 것으로 보인다.특허심판원은 지난 24일 대웅제약과 종근당이 자카비의 특허 한 건에 대해 청구한 소극적 권리범위확인심판에서 인용 심결을 내렸다.식품의약품안전처 의약품특허목록에 따르면 자카비에는 2027년 1월 만료되는 특허와 2028년 6월 만료되는 특허 총 두 건이 적용된다. 대웅제약과 종근당은 이 가운데 2028년 만료.","[프레스나인] 노바티스의 항암제 '자카비(성분명 룩소리티닙)'의 제네릭 조기 출시에 도전한 대웅제약과 종근당이 특허 허들을 넘는 데 성공했다. 품목허가만 남게 된 것으로, 향후 우선판매품목허가 경쟁을 주목해야 할 것으로 보인다.특허심판원은 지난 24일 대웅제약과 종근당이 자카비의 특허 한 건에 대해 청구한 소극적 권리범위확인심판에서 인용 심결을 내렸다.식품의약품안전처 의약품특허목록에 따르면 자카비에는 2027년 1월 만료되는 특허와 2028년 6월 만료되는 특허 총 두 건이 적용된다. 대웅제약과 종근당은 이 가운데 2028년 만료",local,10,노바티스,,,0,,10.0,10.0,10,False
2026-03-27,BD,2026-03-27 15:32:00,Naver News,http://www.ftoday.co.kr/news/articleView.html?idxno=356999,"“부결 뒤집었다”…동성제약, 법원 강제인가로 회생 ‘급물살’",중견 제약사 동성제약의 회생계획안이 법원의 강제인가를 받으면서 인수합병(M&A) 작업이 본격화할 전망이다. 채권자 일부 반대로 한 차례 부결됐던 회생안이 법원 판단으로 뒤집히면서 경영 정상화에 속도가 붙게 됐다.서울회생법원 회생11부(박소영 부장판사)는 27일 동성제약 회생계획안에 대.,중견 제약사 동성제약의 회생계획안이 법원의 강제인가를 받으면서 인수합병(M&A) 작업이 본격화할 전망이다. 채권자 일부 반대로 한 차례 부결됐던 회생안이 법원 판단으로 뒤집히면서 경영 정상화에 속도가 붙게 됐다.서울회생법원 회생11부(박소영 부장판사)는 27일 동성제약 회생계획안에 대,local,10,M&A,,,0,,9.6,9.0,10,False
2026-03-27,BD,2026-03-26 09:16:00,Naver News,https://www.bosa.co.kr/news/articleView.html?idxno=3001563,MSD 백혈병 신약개발사 인수 - 의학신문,MSD가 백혈병 신약을 개발하는 턴스 파마슈티컬스를 67억달러에 인수하기로 합의했다고 발표했다.이는 주당 53달러의 가격으로 턴.,[의학신문·일간보사=김자연 기자] MSD가 백혈병 신약을 개발하는 턴스 파마슈티컬스를 67억달러에 인수하기로 합의했다고 발표했다.이는 주당 53달러의 가격으로 턴,local,10,BMS,,,0,,9.6,9.0,10,False
2026-03-27,Client,2026-03-25 16:10:00,Naver News,http://www.wikileaks-kr.org/news/articleView.html?idxno=185276,CSL코리아 황세은 사장에게 던져진 과제는..,"CSL코리아는 희귀·중증질환 치료제 전문 기업이다.혈우병 등 희귀질환을 담당하는 CSL베링, 철분 결핍과 신장 질환을 다루는 CSL비포, 인플루엔자 백신을 개발하는 CSL시퀴러스 등 3개 회사로 구성됐다.CSL베링의 혈우병B 치료제 ‘아이델비온(알부트레페노나코그알파)’은 글로벌 8개국에서 2022년부터 2025년 1분기까지 환자 수 1위를 기록한 바 있다.CSL이 한국 법인 수장으로 황세은 신임 사장(사진)을 선임했다. 황 사장은 CSL코리아의 국내 사업 전략을 총괄하며 희귀·중증질환 치료제 포트폴리오 확대에 나선다.25일 CSL코.","CSL코리아는 희귀·중증질환 치료제 전문 기업이다.혈우병 등 희귀질환을 담당하는 CSL베링, 철분 결핍과 신장 질환을 다루는 CSL비포, 인플루엔자 백신을 개발하는 CSL시퀴러스 등 3개 회사로 구성됐다.CSL베링의 혈우병B 치료제 ‘아이델비온(알부트레페노나코그알파)’은 글로벌 8개국에서 2022년부터 2025년 1분기까지 환자 수 1위를 기록한 바 있다.CSL이 한국 법인 수장으로 황세은 신임 사장(사진)을 선임했다. 황 사장은 CSL코리아의 국내 사업 전략을 총괄하며 희귀·중증질환 치료제 포트폴리오 확대에 나선다.25일 CSL코",local,10,애보트,,,0,,9.6,9.0,10,False
2026-03-27,BD,2026-03-27 10:10:00,Naver News,https://www.yakup.com/news/index.html?mode=view&cat=16&nid=325270,"[약업신문]伊 레코르다티, 민간투자사서 125억弗 인수제안",이탈리아의 글로벌 제약기업 레코르다티社(Recordati)가 일부 언론에 의해 제기된 항간의 루머와 관련한 입장을 26일 내놓았다.이날 레코르다티 측은 25일 늦은 시간에 영국의 글로벌 민간투자기업 CVC 캐...,이탈리아의 글로벌 제약기업 레코르다티社(Recordati)가 일부 언론에 의해 제기된 항간의 루머와 관련한 입장을 26일 내놓았다.이날 레코르다티 측은 25일 늦은 시간에 영국의 글로벌 민간투자기업 CVC 캐...,local,10,레코르다티,,,0,,9.6,9.0,10,False
2026-03-27,BD,2026-03-27 17:30:00,Naver News,https://www.yakup.com/news/index.html?mode=view&cat=12&nid=325299,"[약업신문]허벌라이프, 英 맞춤형 보충제 기업 M&A 합의",허벌라이프가 건강 접근성을 높이고 실행 가능하게 하는 데 사세를 집중하고 있는 영국의 맞춤형 건강 보충제 기업 바이오닉(Bioniq)으로부터 자산의 상당부분(certain assets)을 인수하기로 합의했다고 26...,허벌라이프가 건강 접근성을 높이고 실행 가능하게 하는 데 사세를 집중하고 있는 영국의 맞춤형 건강 보충제 기업 바이오닉(Bioniq)으로부터 자산의 상당부분(certain assets)을 인수하기로 합의했다고 26...,local,10,M&A,,,0,,9.6,9.0,10,False
2026-03-27,BD,2026-03-27 15:52:00,Naver News,http://www.nongaek.com/news/articleView.html?idxno=94873,동성제약 한시름 놨다...회생계획안 대로 정상화 돌입,"기업회생 절차를 진행 중인 동성제약의 회생계획안이 법원에서 강제 인가됐다. 이에 따라 인수자인 연합자산관리(유암코)·태광산업 컨소시엄의 인수합병(M&A) 작업에 속도가 붙을 전망이다.서울회생법원 회생11부(박소영 부장판사)는 27일 동성제약의 회생계획안에 대해 권리보호조항을 정한 인가결정(강제인가)을 내렸다고 밝혔다.강제인가는 회생계획안이 부결된 경우에도 법원이 채권자들의 이익과 회생 가능성을 고려해 직권으로 회생계획안을 승인해주는 것을 말한다.지난 18일 열린 관계인집회에서 회생담보권자, 회생채권자, 주주 등 이해관계인 3개조(組.","기업회생 절차를 진행 중인 동성제약의 회생계획안이 법원에서 강제 인가됐다. 이에 따라 인수자인 연합자산관리(유암코)·태광산업 컨소시엄의 인수합병(M&A) 작업에 속도가 붙을 전망이다.서울회생법원 회생11부(박소영 부장판사)는 27일 동성제약의 회생계획안에 대해 권리보호조항을 정한 인가결정(강제인가)을 내렸다고 밝혔다.강제인가는 회생계획안이 부결된 경우에도 법원이 채권자들의 이익과 회생 가능성을 고려해 직권으로 회생계획안을 승인해주는 것을 말한다.지난 18일 열린 관계인집회에서 회생담보권자, 회생채권자, 주주 등 이해관계인 3개조(組",local,10,M&A,,,0,,9.6,9.0,10,False
2026-03-27,Client,2026-03-26 12:14:00,Naver News,https://www.kpanews.co.kr/news/articleView.html?idxno=531758,"다케다, 추가 구조조정으로 연 2000억엔 절감 노린다 - 약사공론",다케다(Takeda)가 신약 출시와 후기 파이프라인 개발 재원을 확보하기 위해 대규모 구조조정에 착수한다. 회사는 3월 25일 발표한 새 효율화 이니셔티브를 통해.,다케다(Takeda)가 신약 출시와 후기 파이프라인 개발 재원을 확보하기 위해 대규모 구조조정에 착수한다. 회사는 3월 25일 발표한 새 효율화 이니셔티브를 통해,local,10,BMS,,,0,,9.2,8.0,10,False
2026-03-27,Client,2026-03-27 12:02:00,Naver News,https://www.dailypharm.com/user/news/336877?REFERER=NP,"[데일리팜]AKT 항암제 '티루캡', 2분기 암질환심의위 상정 촉각","경구용 AKT 항암제 티루캡이 보험급여 등재로 향하는 중요한 관문에 진입한다. 취재 결과, 한국아스트라제네카는 지난해 호르몬 수용체(HR) 양성·인간표피성장인자 수용체2(HER2) 음성 진행성 유방암치료제 티루캡(카피바설팁)의 급여 신청을 제출했으며, 현재 건강보험심사평가원 암질환심의위원회 상정 일정을 조율중이다. 이르면 5월 상정이 기대된다. 티루캡이 암질심을 통과하고 최….","경구용 AKT 항암제 티루캡이 보험급여 등재로 향하는 중요한 관문에 진입한다. 취재 결과, 한국아스트라제네카는 지난해 호르몬 수용체(HR) 양성·인간표피성장인자 수용체2(HER2) 음성 진행성 유방암치료제 티루캡(카피바설팁)의 급여 신청을 제출했으며, 현재 건강보험심사평가원 암질환심의위원회 상정 일정을 조율중이다. 이르면 5월 상정이 기대된다. 티루캡이 암질심을 통과하고 최…",local,10,아스트라제네카,,,0,,9.2,8.0,10,False
2026-03-27,Client,2026-03-25 10:20:00,Naver News,http://www.press9.kr/news/articleView.html?idxno=74030,"유한양행 ‘렉라자’, 독일 급여 진입…유럽 최대 시장 공략 본격화","유한양행의 폐암 신약 ‘렉라자(성분명 레이저티닙)’가 독일 건강보험 급여 체계에 진입하며 유럽 시장 공략이 본격화됐다. 유럽 최대 의약품 시장인 독일에서의 급여 등재를 계기로 글로벌 매출 확대 기대감이 커지고 있다.업계에 따르면 렉라자는 독일 건강보험 급여 평가를 담당하는 연방공동위원회(G-BA) 절차를 거쳐 보험 청구 코드가 부여됐다.이번에 80mg과 240mg 제형에 각각 코드가 부여되면서 현지 의료기관에서 보험 청구가 가능해졌으며, 이는 곧 실제 처방과 비용 정산이 가능한 상태에 진입했음을 의미한다.청구 코드는.","[프레스나인] 유한양행의 폐암 신약 ‘렉라자(성분명 레이저티닙)’가 독일 건강보험 급여 체계에 진입하며 유럽 시장 공략이 본격화됐다. 유럽 최대 의약품 시장인 독일에서의 급여 등재를 계기로 글로벌 매출 확대 기대감이 커지고 있다.업계에 따르면 렉라자는 독일 건강보험 급여 평가를 담당하는 연방공동위원회(G-BA) 절차를 거쳐 보험 청구 코드가 부여됐다.이번에 80mg과 240mg 제형에 각각 코드가 부여되면서 현지 의료기관에서 보험 청구가 가능해졌으며, 이는 곧 실제 처방과 비용 정산이 가능한 상태에 진입했음을 의미한다.청구 코드는",local,10,아스트라제네카,,,0,,9.2,8.0,10,False
2026-03-27,Client,2026-03-26 17:12:00,Naver News,http://www.medical-tribune.co.kr/news/articleView.html?idxno=213381,국제성모병원 최신 진단검사 자동화 시스템 도입,가톨릭관동대 국제성모병원이 검체 접수부터 결과 보고까지 전 과정을 자동 처리하는 '최신 진단검사 자동화 시스템('TLA)을 도입했다. 이 시스템은 로슈(Roche)의 자동화 솔루션을 기반으로 임상화학 및 면역 분석 장비를 통합해 대량의 검사를 신속·정확하게 처리할 수 있다.,가톨릭관동대 국제성모병원이 검체 접수부터 결과 보고까지 전 과정을 자동 처리하는 '최신 진단검사 자동화 시스템('TLA)을 도입했다. 이 시스템은 로슈(Roche)의 자동화 솔루션을 기반으로 임상화학 및 면역 분석 장비를 통합해 대량의 검사를 신속·정확하게 처리할 수 있다. 또한 자동,local,10,로슈,,,0,,9.2,8.0,10,False
