date,category,published_date,site_name,url,title,summary,region,score_ag,keywords,reward,rl_score
2026-02-12,Client,2026-02-12 06:02:00,Naver News,https://www.dailypharm.com/user/news/335682?REFERER=NP,ADC 이어 면역항암제도 허가…난소암 신약 다층화 예고,"일라이릴리도 새로운 이 질환을 타깃하는 새로운 ADC 개발에 집중하고 있다. 키트루다+파클리탁셀... 릴리, 차세대 FRα ADC 개발 면역항암제 키트루다가 백금저항성 난소암에서 FDA 허가를 받으며 치료 옵션이 넓어진... ",local,5,릴리,,
2026-02-12,Client,2026-02-11 13:02:00,Naver News,http://www.newstown.co.kr/news/articleView.html?idxno=693902,"한국비엔씨, 비만치료후보물질 마운자로와 동등수준 효과 및 효과지속 우위성","한국비엔씨(대표이사: 최완규)는 2월 11일 ㈜프로앱텍(대표이사: 조정행)과 공동개발하고 있는 지속형 비만치료제중 GLP-GIP-GCG 삼중작용제-알부민 혹은 지방산 접합체 3차 후보물질의 동물실험결과, 릴리의 마운자로(성분: 터제파타이드)대비 동등한 수준의 체중감소 효과를 확인하였고 투여기간 경과시의 효과 지속면에서는 마운자로보다 우위의 체중감소 효과를 확인했다고 밝혔다.프로앱텍은 독자적인 펩타이드 디자인을 통해 GLP-1과 함께 GCG 및 GIP 수용체에 작용 활성이 있는 다중 작용 펩타이드 3차 후보물질 7종을 개발하였고, 이.",local,5,릴리,,
2026-02-12,Client,2026-02-11 12:00:00,Naver News,http://www.bosa.co.kr/news/articleView.html?idxno=2269658,파킨슨병·알츠하이머 유망 신약후보 주목,올해 파킨슨병 및 알츠하이머에 여러 유망 신약후보가 주목된다고 바이오스페이스가 전했다.이에 따르면 최근 AC 이뮨이 개발한 면역치료제가 2상 임상시험 결과 처음으로 파킨슨병 진행을 지연시키는 것으로 나타나는 등 치료 지형을 근본적으로 변화시킬 가능성이 있다.AC 이뮨의 면역치료제 ACI-7104.056는 a-syn(alpha-synuclein) 뇌 단백질을 타깃 삼고 있다.파킨슨병 단백질병증의 특징인 a-syn은 잘못 접혀 서로 엉겨 붙으며 독성 응괴를 형성하는데 ACI-7104.056는 면역계를.,local,5,MSD,,
2026-02-12,Client,2026-02-11 11:32:00,Naver News,https://mdtoday.co.kr/news/view/1065579988407351,"에이비엘바이오, 차세대 면역항암 표적 4-1BB 연구 국제학술지 게재",이중항체 플랫폼 ′그랩바디-T′ 활용한 신약 개발 성과…기존 단일항체 한계 극복 가능성 제시.,local,5,사노피,,
2026-02-12,Client,2026-02-10 06:44:00,Naver News,https://www.kpanews.co.kr/news/articleView.html?idxno=529202,"바이엘, FXIa 억제제 경쟁서 선두…아순덱시안 3상 성과 공개 - 약사공론",바이엘(Bayer)의 제11혈액응고인자(factor XIa) 억제제 아순덱시안(asundexian)이 3상 임상에서 뇌졸중 위험을 유의하게 낮춘 구체 데이터를 공.,local,5,바이엘,,
2026-02-12,Client,2026-02-12 06:02:00,Naver News,https://www.yakup.com/news/index.html?mode=view&cat=12&nid=323228,[약업신문]AI·메타버스 앞세운 제약 스마트공장…관건은 데이터와 시스템 연동,"AI와 메타버스 기술이 제약 제조 현장으로 빠르게 확산되는 가운데, 스마트공장의 경쟁력은 화려한 기술 도입이 아니라 ‘데이터 통합과 활용 역량’에 달려 있다는 현장 메시지가 나왔다.한국혁신의약품컨소시엄은...",local,5,BMS,,
2026-02-12,Client,2026-02-12 08:18:00,Naver News,http://www.medisobizanews.com/news/articleView.html?idxno=134594,"“차세대 비만 치료제, 20% 이상 체중감소도 가능”","위고비, 마운자로 등으로 대표되는 GLP-1 기반 비만 치료제가 식욕 및 에너지 소비와 연관된 장·췌장 호르몬 신호를 복합적으로 조절하는 약물로 빠르게 진화하고 있다는 분석이 나왔다. 이에 따라 평균 체중 감소율이 15% 안팎인 현행 치료제를 넘어 20%를 넘어서는 차세대 약제가 등장할 가능성도 점쳐진다.분당서울대병원 내분비대사내과 임수 교수 연구팀과 가톨릭의대 부천성모병원 손장원 교수 연구팀은 세계적 비만ㆍ당뇨 전문가인 독일 보훔대학 마이클 넉(Michael A. Nauck) 박사와 함께 국제 학술지 ‘Endocrine Revie.",local,5,위고비,,
2026-02-12,Client,2026-02-12 06:36:00,Naver News,http://www.medisobizanews.com/news/articleView.html?idxno=134591,"만성 이식편대숙주질환 약물 자카비-레주록, 환상의 ‘깐부 치료’","만성 이식편대숙주질환(cGVHD) 치료 패러다임이 ‘단일 약물간 경쟁’에서 ‘순차적 치료의 완성’으로 전환되고 있다. 기존 치료제가 염증 완화에 집중됐다면, 최근에는 장기 생존을 담보하고 비가역적 조직 손상 회복까지 겨냥하는 단계별 정밀 치료 전략이 가능해졌다는 게 의료계의 평가다.의료 현장에서는 2차 치료제인 노바티스의 ‘자카비(룩소리티닙)’와 3차 치료제로 진입한 사노피의 ‘레주록(벨루모수딜)’이 만들어낼 시너지에 주목하고 있다. 두 약물은 작용기전이 명확히 구분돼 서로의 치료 공백을 보완하는 상호 보완적 구조를 형성한다는 점에.",local,5,사노피,,
2026-02-12,Client,2026-02-11 11:04:00,Naver News,https://biz.newdaily.co.kr/site/data/html/2026/02/11/2026021100158.html,"삼성·셀트리온·롯데 CDMO, 美-中 패권 다툼 속 '반사이익' 볼 수 있을까",미국 생물보안법 통과로 미·중 바이오 패권 경쟁이 본격화되면서  국내 제약·바이오 위탁개발생산(CDMO)  3사가 미국 현지 생산기지 확보를 통해 '반사이익'을 기대하고 있다. 글로벌 최대 시장인 미국에서 안정적 생산 가능 여부가 경쟁력으로 직결된다는 판단에서다.다만 중국 바이오기업의 빈자리를 노리는 경쟁이 한층 치열해질 것이라는 신중론도 제기된다.,local,5,릴리,,
2026-02-12,Client,2026-02-09 06:00:00,Naver News,http://www.bosa.co.kr/news/articleView.html?idxno=2269060,[다국적제약 우리 부서가 뛴다]한국오가논 마이 프로페시아 팀,"남성형 탈모 치료는 약을 복용하는 것만으로 끝나지 않는다. 모발의 성장 주기는 수개월 단위로 이어지기 때문에 환자들은 치료 초기에 효과를 체감하기까지 불안과 의문을 느끼는 경우가 많다. 장기 복용이 필요한 치료 특성상, 치료를 꾸준히 이어갈 수 있도록 돕는 보조적 관리 수단의 필요성도 꾸준히 제기돼 왔다.이러한 문제의식에서 출발한 한국오가논 ‘마이 프로페시아’ 팀은 2023년 10월, 남성형 탈모 환자의 치료 관리를 지원하는 애플리케이션 ‘마이 프로페시아(My Propecia)’를 전 세계 최초로 국.",local,5,오가논,,
2026-02-12,Client,2026-02-11 12:10:00,Naver News,https://www.kpanews.co.kr/news/articleView.html?idxno=529368,"AZ, ""블록버스터 25개로 리스크 분산""...2030년 매출 800억달러 - 약사공론",아스트라제네카(AstraZeneca)가 2025년 4분기 호실적을 바탕으로 2030년 매출 800억달러 달성 목표를 재확인했다. 회사는 10년 말까지 연 매출 1.,local,5,아스트라제네카,,
2026-02-12,Client,2026-02-12 09:12:00,Naver News,https://www.mt.co.kr/society/2026/02/12/2026021208525679149,"""살 빠진 건 잠깐?"" 10kg 뺐다가 '허탈'...위고비 끊고 4배 빨리 쪘다 - 머니투데이","영국 옥스퍼드대학교 샘 웨스트 박사가 발표한 연구에 따르면, 위고비 등 GLP-1 계열 비만치료제를 복용한 환자들은 평균 8.3kg 감량했으나, 복용 중단 후 한 달에 0.8kg씩 체중이 증가해 1년 반 만에 감량 전 체중으로 돌아갈 가능성이 높다고 분석되었다.",local,5,위고비,,
2026-02-12,Client,2026-02-11 13:56:00,Naver News,http://www.hemophilia.co.kr/news/articleView.html?idxno=40931,"키르기스스탄, 꾸준한 정책 활동으로 혈우병 치료 환경 크게 개선 - 헤모필리아라이프",중앙아시아의 국가 키르기스스탄에서 혈우병을 비롯한 출혈성 질환 치료 환경이 눈에 띄게 나아지고 있다. 이는 수년간 이어진 국제 혈우병 단체의 지속적인 정책 활동과.,local,5,사노피,,
2026-02-12,BD,2026-02-12 09:12:00,Naver News,https://www.koreahealthlog.com/news/articleView.html?idxno=55853,아이 얼굴에 나타난 '나비 모양 발진'…전신홍반루푸스 신호탄,"아이 얼굴에 갑자기 나비 모양의 발진이 생기고, 이 발진이 햇볕을 볼 때 더 심해지는 양상을 보일 때 의심해봐야 하는 질환이 있다. 우리 몸의 면역시스템이 자기 자신을 공격하는 자가면역질환 '전신홍반루푸스'가 그것이다. 서울대병원 소아청소년과 김성헌 교수는 '서울대병원tv'에서 ""전신홍반루푸스는 피부, 관절, 신장, 심장, 뇌 등 온몸 곳곳에 염증이 생길 수 있다""며 ""전신홍반루푸스의 가장 대표적인 증상이 얼굴에 나타나는 나비 모양의 발진""이라고 말했다.",local,4,생물학적제제,,
2026-02-12,BD,2026-02-12 08:02:00,Naver News,https://www.hani.co.kr/arti/hanihealth/pharm/1244629.html,재정 논리에 의한 약가 인하의 위험성,정부의 약가 인하 정책이 다시 속도를 내고 있다. 건강보험 재정의 지속 가능성을 고민해야 한다는 문제의식 자체는 충분히 공감할 만하다. 그러나 지금 추진되는 방식이 과연 국민 건강과 이제 겨우 출발선에 선 대한민국 신약 개발 생태계와 국내 제약바이오 산업의 미래까지 함.,local,4,제네릭,,
2026-02-12,BD,2026-02-10 19:14:00,Naver News,https://www.bloter.net/news/articleView.html?idxno=654019,"[제약사 리포트] 동아에스티, '마진 관리·도입 품목 의존' 과제",동아에스티가 사상 최대 매출을 기록했지만 수익성은 오히려 후퇴했다. 재고자산 정리에 따른 일회성 비용과 도입 품목 중심 매출 구조가 맞물리며 분기 실적이 흔들린 영향이다. 외형 성장과 비용 관리 사이의 균형이 향후 실적 개선의 핵심 과제로 떠오르고 있다. 재고자산 폐기 집중 4분기 '.,local,4,입센,,
2026-02-12,BD,2026-02-11 06:13:00,Naver News,https://www.yna.co.kr/view/AKR20260210163600017?input=1195m,"AI가 바꾸는 신약 개발, 한국은 왜 더디나 | 연합뉴스",올해는 국내 제약·바이오 기업의 인공지능(AI) 활용 방식이 한단계 더 발전할 수 있을지 주목된다.,local,4,화이자,,
2026-02-12,BD,2026-02-12 09:38:00,Naver News,http://www.bosa.co.kr/news/articleView.html?idxno=2269930,"눈 뒤 종양 ‘안와 우연종’, 세계 첫 치료 가이드라인 제시",최근 건강검진이나 두통으로 뇌 검사를 했다가 예상치 못하게 눈 뒤 공간인 안와에서 종양이 발견되는 사례가 늘고 있는 가운데 최근 국내 연구진이 안와 우연종의 특징과 치료 원칙을 분석해 치료 가이드라인을 세계 최초로 제시했다.안와 우연종(incidentaloma)은 눈에 특별한 이상 증상이 없는데 다른 검사를 하다가 눈 주변에서 우연히 발견되는 혹이나 종양을 말한다.서울아산병원 안과 사호석 교수팀은 서울아산병원에서 안와 우연종이 발견된 환자 43명을 대상으로 임상적 특징과 치료 경과를 분석했다.그 결.,local,4,합병,,
2026-02-12,BD,2026-02-12 09:20:00,Naver News,https://www.widedaily.com/news/articleView.html?idxno=288706,"""유통마진 깎자""…약가인하에 의약품 유통업계도 '쇼크'",정부가 추진 중인 제네릭(복제약) 중심의 약가 인하 정책이 제약업계는 물론 의약품 유통업계 전반에 큰 충격을 줄 것이라는 우려가 나오고 있다.12일 유통업계에 따르면 연초부터 약가 인하 정책 시행에 대한 불안감이 확산되면서 제약사들이 유통 마진을 낮추려는.,local,4,제네릭,,
2026-02-12,BD,2026-02-12 06:00:00,Naver News,https://www.pharmnews.com/news/articleView.html?idxno=301466,"12조 반려동물 시장 도전장...""유유제약, 퍼스트무버로 뛸 것"" - 팜뉴스","유유제약이 반려동물 바이오의약품 시장을 신성장 동력으로 설정하고, 글로벌 시장 5위의 동물의약품 개발사가 되겠다는 미래 비전을 밝혔다.",local,4,M&A,,
2026-02-12,BD,2026-02-10 15:02:00,Naver News,https://www.hellot.net/news/article.html?no=110226,"[헬로티 HelloT] 갤럭스, 420억원 시리즈B 투자 유치로 성장 가속",신약 설계 인공지능 플랫폼 기업 갤럭스가 420억원 규모의 시리즈B 투자 유치를 완료하며 누적 투자금 680억원을 확보했다. 갤럭스는 이번 투자를 통해 AI 기반 항체 신약 설계 플랫폼 고도화와 글로벌 진출을 본격화한다고 10일 밝혔다. 갤럭스는 2022년 210억원 규모의 시리즈A 투자 유치 이후 연구개발과 사업 성과를 지속적으로 축적해 왔다.,local,4,베링거인겔하임,,
2026-02-12,BD,2026-02-07 06:02:00,Naver News,https://www.dailypharm.com/user/news/335547?REFERER=NP,"[데일리팜]'엑스탄디' 특허만료 임박…아스텔라스, 후속 신약개발 속도",아스텔라스가 전립선암 치료제 '엑스탄디'의 특허 만료를 앞두고 후속 항암 파이프라인 확장에 속도를 내고 있다. 위암·요로상피암에서 혁신신약(First-in-class)을 연이어 출시한 데 이어 이중항체·단백질 분해제·유전자치료제·세포치료제까지 다층적 모달리티로 개발 전략을 넓히는 모습이다. 7일 관련 업계에 따르면 아스텔라스는 최근 신약개발 계획을 통해 엑스탄디(엔잘루타마이드)….,local,4,아스텔라스,,
2026-02-12,BD,2026-02-12 05:34:00,Naver News,https://www.dailymedi.com/news/news_view.php?wr_id=933862,유원상 유유제약 대표 승부수 '고양이 의약품',﻿﻿﻿﻿﻿유원상 유유제약 대표가 반려묘 '아리'를 소개하고 있다.,local,4,CSO,,
2026-02-12,BD,2026-02-12 06:01:00,Naver News,https://biz.chosun.com/science-chosun/bio/2026/02/12/CSURR5S7UZDXBHWQVIHNKLXTFM/?utm_source=naver&utm_medium=original&utm_campaign=biz,5대 제약사 총매출 9조 눈앞...이익 가른 글로벌 수익 구조,5대 제약사 총매출 9조 눈앞...이익 가른 글로벌 수익 구조 2025년 유한·GC·한미·종근당·대웅 매출 증가 삼성바이오·셀트리온 연매출 4조원 돌파 이익 희비 가른 글로벌 수익 구조 R&D 결실이 성장 견인 제네릭·내수 의존도 낮춰야.,local,4,약가,,
2026-02-12,BD,2026-02-12 09:35:00,Naver News,https://www.yna.co.kr/view/AKR20260212046000530?input=1195m,"질병청, 니파바이러스환자 나온 인도·방글라 중점검역지역 지정 | 연합뉴스",질병관리청은 지난 달 인도에서 니파바이러스 감염증 환자가 발생한 데 이어 방글라데시에서도 같은 환자가 발생함에...,local,4,백신,,
2026-02-12,BD,2026-02-12 07:02:00,Naver News,https://www.thebell.co.kr/free/content/ArticleView.asp?key=202602111532006680102030,"[더벨]HK이노엔, '자체제품'의 힘 5년만에 두자리 이익률 회복","이밖에도 중남미 시장에서의 상업적 성과와 이를 기반으로 한 유럽 판권 계약 가능성도 향후 수익성 제고의 핵심 요인으로 작용할 전망이다. HK이노엔 관계자는 ""국내 및 해외 시장에서 신약 케이캡의 활약을 위해... ",local,4,판권,,
2026-02-12,BD,2026-02-12 06:00:00,Naver News,https://www.pharmnews.com/news/articleView.html?idxno=301463,"[해설] 복지부, 토종기업 약값 깎아 외자사에 '3조 헌납' 하나 - 팜뉴스",국내 제약산업의 근간인 제네릭 일괄약가인하에서 만들어진 3조 원대 건보재정 절감액이 중증 희귀질환약 경제성 평가 면제 제도로 인해 고스란히.,local,4,약가,,
2026-02-12,BD,2026-02-12 07:14:00,Naver News,https://www.newsway.co.kr/news/view?ud=2026021114331423621,"김정균號 보령, 신약 '카나브' 확장 전략 가속화 - 뉴스웨이","보령이 자체 신약 카나브를 기반으로 한 복합제 라인업 확대 전략을 통해 2023년 역대 최대 실적을 달성했다. 복합신약 BR1018의 임상 3상에서 우수한 결과를 확보하며, 특허 만료와 약가 인하 소송 등 변수에도 불구하고 시장 입지를 강화하고 있다.",local,4,판권,,
2026-02-12,BD,2026-02-11 11:42:00,Naver News,http://www.newsmp.com/news/articleView.html?idxno=251590,"GSK 싱그릭스, 자가면역질환 환자에서 안전성 확인","GSK의 재조합 대상포진 백신 싱그릭스가 자가면역질환 환자에게도 안전하다는 연구 결과가 보고됐다.자가면역질환자 중 비접종자와 비교해 악화 위험에 차이가 없었으며, 자가면역질환이 없는 사람과의 비교에서는 이상반응에 차이가 없었다는 것.최근 The Lancet Rheumatology에는 브라질의 2차 의료기관에서 싱그릭스가 류마티스성 자가면역질환 환자에 미치는 영향을 평가한 임상 4상 결과가 게재됐다.연구는 2023년 5월부터 2024년 11월까지 류마티스성 자가면역질환이 있는 환자 1192명을 대상으로 싱그릭스군과 위약군.",local,4,GSK,,
2026-02-12,BD,2026-02-09 06:06:00,Naver News,http://www.newsmp.com/news/articleView.html?idxno=251540,"크론병에 선진 치료법, 안전성보다 효능에 주목해야","크론병 환자에서 TNF-α 억제제와 인터루킨 억제제, 인테그린 억제제, JAK 억제제 등 이른바 선진 치료법(Advanced Therapy)의 안전성에 큰 차이가 없다는 연구 결과가 보고됐다.임상의들은 선진 치료법의 안전성보다 각 치료제의 효능에 주목해 의사 결정을 내릴 필요하 있다는 조언이다.최근 미국의사협회지 JAMA NerworkOpen에는 OptumLabs 청구 데이터를 토대로 2016년부터 2022년 사이에 선진 치료법으로 치료를 받은 1만 2245명을 평균 26.9개월간 추적 관찰하며 심각한 감염, 위장관 감.",local,4,생물학적제제,,
2026-02-12,BD,2026-02-12 09:50:00,Naver News,https://www.yna.co.kr/view/AKR20260212048700017?input=1195m,"[바이오스냅] 대원제약, 감기약 '대원콜 연질캡슐' 3종 출시 | 연합뉴스",대원제약[003220]은 증상에 따라 차별화된 처방을 적용한 감기약 브랜드 '대원콜 연질캡슐' 시리즈를 새롭게 출시했다고 12일 밝혔다.,local,4,파트너십,,
2026-02-12,BD,2026-02-06 11:18:00,Naver News,https://www.medicopharma.co.kr/news/articleView.html?idxno=67028,"‘허·평·협 연계 1호’ 빌베이, 상급종합병원 안착…처방 물꼬 텄다","허가-평가-협상 연계 시범사업 1호 약제인 빌베이 캡슐(성분명 오데빅시바트, 이하 빌베이)이 최근 급여 등재에 이어 상급종합병원 처방권에 진입했다. 신속 허가와 조기 급여 진입을 위한 제도 적용 사례가 실제 처방 단계까지 이어졌다는 점에서 주목된다.6일.",local,4,입센,,
2026-02-12,BD,2026-02-12 09:54:00,Naver News,http://www.kmedinfo.co.kr/news/articleView.html?idxno=94561,"시지바이오, 세계 최대 미용성형학회 ‘IMCAS 2026’ 성료",시지바이오는 프랑스 파리에서 열린 세계 최대 규모의 미용성형학회 ‘임카스 월드 콩그레스 2026(IMCAS World Congress 2026)’에 참가했다고 12일 밝혔다.IMCAS(International Master Course on Aging Science)는 올해로 28회를.,local,4,파트너십,,
2026-02-12,BD,2026-02-12 09:41:00,Naver News,https://health.chosun.com/site/data/html_dir/2026/02/11/2026021103757.html,당뇨병과 고혈압은 뗄 수 없는 관계… ‘이것’부터 잡아라,당뇨병과 고혈압은 서로 다른 질환처럼 보이지만 실제로는 긴밀하게 연결돼 있다. 실제로 당뇨 환자의 절반가량은 고혈압을 동반하고 있다. 당뇨 환자의 올바른 혈당과 혈압 관리에 대해 알아본다. ◇고혈당으로 미세혈관 망가져 당뇨병 환자는 고혈압이 발생할 위험이 일반인에 비해 약 두 배 높다. 당뇨가 진행되다 보면 고혈당에 의해 콩팥 기능이 손상되면서 혈압이 상승한다. 당뇨병 환자가 혈압까지 높으면 혈관이 매우 빠르게 파괴된다.,local,4,합병,,
2026-02-12,BD,2026-02-05 06:12:00,Naver News,https://www.hitnews.co.kr/news/articleView.html?idxno=73589,"'크레온' 제형 변경 두고 특허 공방… 애보트, '적극적심판' 카드",췌장효소 대체제 '크레온캡슐'을 둘러싼 특허 분쟁이 재점화 됐다. 특허권자인 애보트가 제네릭 후발주자 테라젠이텍스를 상대로 적극적 권리범위확인심판을 제기하며 제형 변경 제품을 둘러싼 법적 공방이 시작됐다. 4일 제약특허연구회 데일리알럿에 따르면 애보트는 크레온캡슐 조성특허(KR1344546)를 앞세워 테라젠이텍스를 상대로 적극적 권리범위확인심판을 제기했다. 테라젠이텍스의 제형 변경 제품이 자사 특허를 침해하는지 여부를 특허심판원 판단으로 가리겠다는 취지다.해당 특허는 '산 불안정성 약제를 위한 조절방출 약제학적 조성물'에 관한 특허.,local,4,애보트,,
2026-02-12,BD,2026-02-12 07:02:00,Naver News,https://www.thebell.co.kr/free/content/ArticleView.asp?key=202602100208511920101484,"[더벨][인벤테라 IPO] 본질 경쟁력 나노입자 조절 플랫폼, 밸류 반영 안...",차세대 항암제로 각광받는 ADC는 항체와 항암제를 결합해 암세포만 선택적으로 공격한다. 최근 수년간 글로벌 제약사들이 수조원대 기술이전 계약을 체결하는 핵심 개발 영역이지만 물에 잘 녹지 않는 소수성... ,local,4,항암제,,
2026-02-12,BD,2026-02-09 18:46:00,Naver News,https://www.kukinews.com/article/view/kuk202602090314,"부광약품, ‘매출 2000억 시대’ 열었다…신약 라투다‧자회사 성과 가시화","부광약품이 창사 이래 처음으로 매출 2000억원을 돌파하며 사상 최대 실적을 달성했다. 한국유니온제약 인수, 자회사 콘테라파마의 핵심 파이프라인 &ls.",local,4,코프로모션,,
2026-02-12,BD,2026-02-09 17:18:00,Naver News,https://www.hankyung.com/article/2026020944561,"""올 신약 최대 격전지는 뇌질환 치료제""","""올 신약 최대 격전지는 뇌질환 치료제"", 치매·알츠하이머 등 신약 기술 글로벌 빅파마들 잇따라 도입.",local,4,바이오젠,,
2026-02-12,BD,2026-02-10 18:10:00,Naver News,http://www.finomy.com/news/articleView.html?idxno=249489,"코로나19·진단·치료제·백신개발 관련주, '웃음' SV인베스트먼트·유투바이오·현대바이오... '눈물' 진원생명과학","현대경제신문 홍미경 기자 | 코로나19·진단·치료제·백신개발 관련주들이 전 거래일 대비 1.94% 상승으로 장을 마감했다.10일 한국거래소에 따르면 유투바이오, SV인베스트먼트, 현대바이오, 셀리드, 랩지노믹스, 휴마시스, 파미셀, 진원생명과학, 바이오스마트는 상승했다.유투바이오와 S.",local,4,바이오젠,,
2026-02-12,BD,2026-02-10 09:02:00,Naver News,https://www.pharmnews.com/news/articleView.html?idxno=301412,"릴리, ‘인 비보’ 기술에 16조 원 배팅… 세포치료제 새 판 짠다 - 팜뉴스",일라이 릴리(Eli Lilly)가 체내에서 직접 세포치료제를 만드는 ‘인 비보(in vivo·생체 내)’ 기술 확보에 대규모 자금을 투입했.,local,4,애브비,,
2026-02-12,BD,2026-02-11 17:22:00,Naver News,https://www.sisajournal-e.com/news/articleView.html?idxno=419182,‘상품’·신약 비중 높은 제일약품 “대형 복제약 신경 쓰이네”  - 시사저널e,정부의 약가인하 일정에 제약업계가 촉각을 곤두세운 가운데 제일약품은 ‘상품’과 신약 비중이 비교적 높은 상태로 확인됐다.,local,4,특허만료,,
2026-02-12,BD,2026-02-12 09:52:00,Naver News,http://www.kmedinfo.co.kr/news/articleView.html?idxno=94559,"휴젤, ‘바이리즌 스킨부스터 HA’ 사내 교육 진행",휴젤이 ‘바이리즌 스킨부스터 HA’ 임상 활용 가이드를 주제로 임직원 대상 교육을 진행했다고 12일 밝혔다.휴젤은 의료 현장에서 다양하게 활용되고 있는 자사 제품의 시술법에 대한 임직원들의 이해도를 제고하기 위해 지속적으로 사내 교육 프로그램을 마련하고 있다.이번 교육은 잇츠미의원 대.,local,4,파트너십,,
2026-02-12,BD,2026-02-11 10:52:00,Naver News,https://www.startuptoday.co.kr/news/articleView.html?idxno=584597,"[줌업] 삼다수·비타500 먹고 사는 광동제약, 제약은 존재감 없다?","광동제약이 매출 구조가 제약이 아닌 식음료 유통 기업에 가깝다는 지적이 거세다. 회사의 외형 성장은 '삼다수'와 '비타500'이 떠받치고 있는 반면, 신약 개발을 중심으로 한 제약사의 본업은 사실상 주변부로 밀려난 모습이다.지난 2025년 광동제약의 3분기 매출액은 7685억 원이다.",local,4,판권,,
