date,category,published_date,site_name,url,title,summary,region,score_ag,keywords,reward,rl_score
2026-02-12,BD,2026-02-12 09:16:00,Naver News,https://theviewers.co.kr/View.aspx?No=3973432,"[기업탐방] 이지바이오, 해외·M&A로 해자 강화...이익 20% 성장 중인데 PER 5배 - 뷰어스","이지바이오의 사업 축은 사료첨가제와 자돈사료다. 사료첨가제는 매출의 74.81%를 차지하는 핵심 사업으로, 이 가운데 약 60~70%가 해외에서 발생해 실질적인 성장을 견인한다. 사료첨가제는 일반 원료성 사료 대비 기술력이 요구되는 영역으로, 원료성 사료의 마진율이 2~3% 수준인 반면 사료첨가제는 10% 이상 고마진 구조를 보유해 매출 비중 증가에 따라 전사 수익성 개선 효과가 기대된다.",local,4,M&A,,
2026-02-12,BD,2026-02-12 00:11:00,Naver News,https://biz.chosun.com/science-chosun/bio/2026/02/12/IFGMM7KDENHJXKAY2SPXJSCEEI/?utm_source=naver&utm_medium=original&utm_campaign=biz,"日 후지필름, 英 바이오 공장 증설 완료…CDMO 경쟁 격화","日 후지필름, 英 바이오 공장 증설 완료CDMO 경쟁 격화 약 7900억원 투자해 생산능력 확대 론자·삼성바이오 쫓아 위탁생산 수주 경쟁 가속.",local,4,리제네론,,
2026-02-12,BD,2026-02-12 09:44:00,Naver News,https://www.kukinews.com/article/view/kuk202602120040,"비만약, 15% 넘어 20% 감량 목표…식욕 억제 넘어 에너지 소비까지",GLP-1 기반 비만 치료제가 단일 호르몬 조절을 넘어 복합 호르몬 경로를 동시에 겨냥하는 방향으로 빠르게 진화하고 있다는 분석이 나왔다.,local,4,합병,,
2026-02-12,BD,2026-02-12 09:54:00,Naver News,https://www.pointdaily.co.kr/news/articleView.html?idxno=292763,"삼양바이오팜, WHX 두바이 참가…봉합사·지혈제 기술력 선봬","삼양바이오팜이 아랍에미티르 두바이에서 열린 ﻿의료 전시회 'WHX 두바이 2026'에 참가해 자사 봉합사, 지혈제 제품의 기술력을 선보였다고 12일 밝혔다. 이번 전시회에서 ﻿삼양바이오팜은 미늘형 봉합사 '테라픽스', 흡수성 지혈제 '써지가드'를 전시했다. 우수한 기술력과 제품 경쟁력을 알렸다. 테라픽스(국내 브랜드명 모노픽스)는 복강경 및 로봇수술 분야에서 각광받는 미늘형 봉합사다.",local,4,파트너십,,
2026-02-12,BD,2026-02-12 09:50:00,Naver News,https://www.medipana.com/news/articleView.html?idxno=406862,"삼성바이오에피스, 아일리아 바이오시밀러 글로벌 특허 합의 완료 - 메디파나뉴스","삼성바이오에피스(대표이사 김경아 사장)가 안과질환 치료제 '오퓨비즈™(Opuviz, 아일리아 바이오시밀러, 성분명: 애플리버셉트)' 관련 오리지널 의약품 회사인.",local,4,라이선스,,
2026-02-12,BD,2026-02-10 09:50:00,Naver News,http://www.k-health.com/news/articleView.html?idxno=89767,진단도 치료도 사각지대 놓인 ‘결절성 양진’ 아시나요,"# 평범한 일상을 살던 A씨는 어느 날 팔다리에 갑자기 붉은 결절들이 솟아오르기 시작했다. 처음에는 두드러기로, 이후엔 아토피피부염으로 진단받고 열심히 치료했지만 증상은 더 심해지기만 했다. 결국 3년이라는 시간이 지나서야 받은 정확한 진단명은 ‘결절성 양진’이었다. 밤잠을 해치는 극심한 가려움은 물론 눈에 띄는 결절들 때문에 한여름에도 긴팔을 입어야 했으며 사람들도 점차 피하게 됐다.",local,4,생물학적제제,,
2026-02-12,BD,2026-02-10 18:38:00,Naver News,https://www.mk.co.kr/article/11959090,"HK이노엔, 작년 매출 1조원 첫 돌파…케이캡·전문의약품 성장 - 매일경제","케이캡 원외처방액 2179억…점유율 15% 컨디션 매출은 3분기 대비 회복세 HK이노엔은 2025년 개별 기준 매출 1조632억원을 기록하며 처음으로 연 매출 1조원을 넘어섰다고 10일 밝혔다. 영업이익은 1109억원, 당기순이익은 757억원으로 전년 대비 각각 25.7%, 22.9% 증가했다. 연간 실적은 위식도역류질환 신약 ‘케이캡’을 중심으로 주요 전문의약품의 안정적인 성장과 코프로모션 품목 확대가 뒷받침했다.",local,4,코프로모션,,
2026-02-12,BD,2026-02-12 09:46:00,Naver News,http://www.issuenbiz.com/news/articleView.html?idxno=72994,"질병청, 백신 없는 니파바이러스 확산 우려…인도·방글라 입국 검역 강화","질병관리청은 인도와 방글라데시에서 니파바이러스 감염증 환자가 발생함에 따라 두 국가를 중점검역관리지역으로 지정하고 검역을 강화한다고 12일 밝혔다.질병청은 지난달 인도에서 니파바이러스 감염증 환자가 확인된 데 이어 최근 방글라데시에서도 환자가 발생했다고 설명했다. 현재까지 국내 발생 사례는 없으나, 백신과 치료제가 없는 제1급 법정 감염병이라는 점을 고려해 선제적 대응에 나섰다는 것이다.이에 따라 인도와 방글라데시를 방문한 뒤 입국하는 모든 입국자는 12일부터 Q-CODE(또는 건강상태질문서)를 통해 건강.",local,4,백신,,
2026-02-12,BD,2026-02-10 13:56:00,Naver News,http://www.newsmp.com/news/articleView.html?idxno=251572,"릴리, 인비보 CAR-T 개발사 오르나 인수","글로벌 제약기업 일라이 릴리가 미국 소재 세포치료제 개발사 오르나 테라퓨틱스(Orna Therapeutics)를 24억 달러(약 3조4900억 원)에 인수한다.양사는 릴리가 오르나를 인수하기 위한 최종 계약을 체결했다고 9일 밝혔다.오르나는 조작 원형 RNA와 새로운 지질 나노입자(LNP)를 결합해 환자의 체내에서 기저 질환을 치료할 수 있는 세포 치료제가 생성되도록 하는 새로운 계열의 치료제를 개발하고 있다.릴리는 오르나 인수를 통해 유전자 의약품과 인비보(in vivo, 체내) 세포 공학 분야에서 장기적인 혁신을 이.",local,4,MSD,,
2026-02-12,BD,2026-02-11 09:28:00,Naver News,https://news.einfomax.co.kr/news/articleView.html?idxno=4398398,"리가켐바이오 창업주 김용주, 바이오텍 원석 발굴 나선다…VC 설립","리가켐바이오사이언스의 창업주인 김용주 대표가 후배 바이오텍 스타트업 발굴에 나섰다. 최근 후배 기업 지원을 위해 개인 투자사를 설립했다.11일 투자(IB)업계에 따르면 김 대표는 지난달 중순 '더이로운파트너스'를 설립했다. 설립 자본금은 30억 원으로 유한회사 형태로 만들었다. 창업기업, 벤처기업에 투자하기 위한 법인이다. 서울 강남구 삼성동에 둥지를 틀었다.김 대표는 국내 바이오텍 창업생태계에서 롤모델로 꼽힌다.",local,4,얀센,,
2026-02-12,BD,2026-02-11 10:44:00,Naver News,http://www.biospectator.com/view/news_view.php?varAtcId=27816,"엘리시젠, CSO에 '바이오젠 출신' 최진국 전무 영입","최진국 신임 CSO 엘리시젠(Elisigen, 이전 뉴라클제네틱스)은 최고전략책임자(CSO, 전무)로 최진국 박사를 영입했다고 11일 밝혔다.엘리시젠은 전략수립과 중장기 성장전략 강화를 위해 전략실을 신설하.",local,4,CSO,,
2026-02-12,BD,2026-02-12 09:08:00,Naver News,https://www.medicopharma.co.kr/news/articleView.html?idxno=67092,FDA ‘임상 3상 간소화’ 정책 확정 임박…셀트리온에 미칠 영향은,"미국 FDA의 바이오시밀러 정책 변화가 셀트리온의 중장기 사업 환경에 영향을 줄 변수로 거론된다. 비교임상(CES·comparative efficacy study, 통상 임상 3상으로 불리는 절차) 요구 범위가 축소될 경우, 개발 비용과 기간이 낮아져 바이.",local,4,특허만료,,
2026-02-12,BD,2026-02-12 09:44:00,Naver News,https://daily.hankooki.com/news/articleView.html?idxno=1335466,"로킷헬스케어, 미국 동부 최대 의료 네트워크 노스웰 헬스와 '맞손'","인공지능(AI) 초개인화 장기재생 플랫폼 기업 로킷헬스케어는 미국 동부 최대 의료 네트워크인 노스웰 헬스와 피부암 재생 및 창상 재생 기술 협력을 위한 전략적 상호 비밀유지계약(MCA)을 체결했다고 12일 밝혔다.회사측은 ""노스웰 헬스의 점유율은 30~40%로 이번 협업은 미국 병원 직납 고속도로를 확보한 것""이라며 ""이달부터 미국 내 피부암 및 창상 재생 론칭을 위해 노스웰 의료진과 실질적 세부계획을 추진 중""이라고 설명했다.양사는 이번 계약을 위해 지난 수 개월간 상호 협력의 융합 시너지를 검토한 뒤.",local,4,제휴,,
2026-02-12,BD,2026-02-12 09:40:00,Naver News,http://www.press9.kr/news/articleView.html?idxno=72337,"[Generic Trend]비씨월드-영진약품, '서튜러' 제네릭 선점 주인공은?","얀센의 다제내성 결핵 치료제 '서튜러(성분명 베다퀼린)'의 제네릭 시장에서 비씨월드제약과 영진약품의 경쟁이 주목된다.식품의약품안전처에 따르면 지난해 12월 24일자로 베다퀼린 성분 제제의 허가신청이 접수됐다.서튜러에 대한 제네릭 도전은 지난해 9월 4일 비씨월드제약이 특허심판을 청구하면서 시작됐다. 여기에 9월 16일자로 영진약품까지 심판을 청구, 제네릭 시장을 두고 양사의 경쟁이 시작됐다.특허심판 결과는 무승부로 끝났다. 지난해 12월 17일 특허심판원으로부터 양사가 함께 인용 심결을 받아냈던 것.하지만 심결 직후인.",local,4,제네릭,,
2026-02-12,BD,2026-02-12 09:34:00,Naver News,https://www.munhwa.com/article/11568008?ref=naver,병원 아닌 의대에 ‘최첨단 MRI’… “학생 5~10% 의사과학자 육성”,"한국 의과대학은 전통적으로 의사 양성과 진료에 중점을 둬오면서, 연구에는 비교적 소홀하다는 지적을 받아왔다. 연구는 직접적 수익 창출이 어렵고 많은 비용이 들기 때문이다. 고려대 의대는 한국 의대들의 전통적 모델에서 벗어나 연구 중심 대학으로 전환을 시도하고 있다.",local,4,백신,,
2026-02-12,BD,2026-02-12 09:45:00,Naver News,https://www.mt.co.kr/thebio/2026/02/12/2026021209203286613,"""백신·치료제 없어"" 니파바이러스 사망자 나오자 '발칵'...""검역 강화"" - 머니투데이",인도와 방글라데시에서 니파바이러스감염증 환자가 발생하여 아시아 전역의 공항 검역이 강화되고 있다. 질병관리청은 인도와 방글라데시를 중점검역관리지역으로 지정하고 입국자 대상 검역 및 감시체계를 강화하고 있다.,local,4,백신,,
2026-02-12,BD,2026-02-11 11:21:00,Naver News,https://www.etnews.com/20260211000184,"美 '생물보안법' 발효…K-바이오, 공급망·데이터 보안이 수출 관문 됐다",미국이 '생물보안법(Biosecure Act)'을 국방수권법(NDAA)에 포함해 법제화하면서 바이오 산업도 '국가안보 자산'의 영역으로 들어왔다. K-바이오 역시 생산설비 경쟁만으로는 부족한 시대에 접어들었다는 분석이다. 보안·데이터 관리 역량이 새로운 수출 경쟁력으로.,local,4,특허만료,,
2026-02-12,BD,2026-02-11 15:48:00,Naver News,https://www.medicopharma.co.kr/news/articleView.html?idxno=67084,"에보뮨, 아토피 치료 후보 2상서 듀피젠트 유사 효능 신호","에보뮨(Evommune)이 개발 중인 아토피 피부염 치료 후보물질이 2상 임상에서 유의미한 증상 개선 효과를 확인했다. 기존 표준 생물학적제제와 유사한 수준의 개선 폭이 나타나면서, 후속 용량 탐색과 제형 변경을 포함한 추가 임상이 추진될 전망이다.11일.",local,4,생물학적제제,,
2026-02-12,BD,2026-02-12 09:46:00,Naver News,https://www.widedaily.com/news/articleView.html?idxno=288737,"""약효 오래 지속""…'원샷' 유전자 치료제 베팅 제약사들",환자 몸속에 투여된 정상 유전자가 단백질 생산공장 역할을 하는 '유전자 치료제' 개발에 국내외 기업들이 뛰어들고 있다. 한 번 투여로 장기간 효과를 내는 '원샷 치료제' 개발을 목표로 하는 곳도 많다.12일 제약바이오업계에 따르면 비만치료제로 유명한 미국.,local,4,라이선스,,
2026-02-12,BD,2026-02-11 13:50:00,Naver News,https://www.fetv.co.kr/news/article.html?no=212503,"[FETV] 부광약품, 최대실적 갱신 '한국유니온제약 CSO' 개선에 달렸다",부광약품이 최대 실적을 기록하며 확보한 반등의 기세를 이어가기 위해 한국유니온제약(이하 유니온제약)의 ‘CSO(영업대행) 구조 개선’을 핵심 과제로 정했다. 외형 성장을 넘어 유니온제약의 고질적인 적자 원인을 해결해야만 이번 실적 상승세를 계속 유지할 수 있다는 판단에서다. 부광약품은 최근 기업설명회(IR) 행사를 통해 지난해 연결.,local,4,CSO,,
2026-02-12,BD,2026-02-10 06:06:00,Naver News,https://www.medipana.com/news/articleView.html?idxno=406702,"동아에스티, 올해 '성장사업부' 본격 가동…제품 시너지 극대화 노려 - 메디파나뉴스",동아에스티가 올해 전담조직을 통해 성장호르몬 제품 시너지 극대화를 노린다. 회사 대표 성장호르몬 치료제 '그로트로핀'과 성조숙증·.,local,4,입센,,
2026-02-12,BD,2026-02-12 06:02:00,Naver News,https://www.dailypharm.com/user/news/335683?REFERER=NP,[데일리팜]대형 제약바이오 실적 동반 호조...R&D 경쟁력의 힘,"지난해 대형 제약바이오기업들이 호전된 실적 성적표를 받아들었다. 신약, 바이오시밀러, 복합신약, 위탁생산개발(CDMO) 등 연구개발(R&D) 역량으로 구축한 차별화된 경쟁력이 실적 상승의 원동력으로 작용했다. 삼성바이오로직스와 셀트리온은 국내 제약바이오산업 실적 신기록을 연거푸 갈아치웠다. 전통제약사들도 R&D 경쟁력을 기반으로 실적 신기록 행진을 동반 작성했다.",local,4,코프로모션,,
2026-02-12,BD,2026-02-12 09:30:00,Naver News,http://www.edaily.co.kr/news/newspath.asp?newsid=03299686645349864,"니파바이러스 확산에…인도·방글라 방문자, 오늘부터 건강상태 신고해야",인도와 방글라데시를 방문한 후 입국하는 모든 입국자는 오늘(12일)부터 큐코드(Q-CODE)나 건강상태질문서를 통해 건강상태를 신고해야 한다. 지난 1월 인도에 이어 방글라데시에서도 니파바이러스감염증 환자가 잇따라 발생한 데 따른 것이다. 보건당국은 설 연휴 해외 ...,local,4,백신,,
2026-02-12,BD,2026-02-11 18:20:00,Naver News,http://www.finomy.com/news/articleView.html?idxno=249591,"탈모 치료 관련주, '껑충껑충' 프롬바이오·현대약품·샤페론... '주르륵' TS트릴리온","현대경제신문 홍미경 기자 | 탈모 치료 관련주들이 전 거래일 대비 0.42% 상승으로 장을 마감했다.11일 한국거래소에 따르면 프롬바이오, 현대약품, JW신약, 샤페론은 상승했다.프롬바이오와 현대약품은 전 거래일 대비 각각 127원, 670원 오른 1595원과 1만3250원에 거래를.",local,4,CSO,,
2026-02-12,BD,2026-02-12 09:22:00,Naver News,https://www.etnews.com/20260212000028,"'아일리아' 분쟁 종결…삼성바이오에피스, 美 9조원 시장 '정조준'",삼성바이오에피스가 안과질환 치료제 '오퓨비즈'의 미국 시장 진입 시점을 내년 1월로 확정했다. 오리지널 의약품 '아일리아' 개발사인 리제네론·바이엘과 2㎎ 제형 관련 특허 분쟁을 마무리했다. 삼성바이오에피스는 바이오시밀러 오퓨비즈(성분 애플리버셉트)와 관련해 양사와 미.,local,4,라이선스,,
2026-02-12,BD,2026-02-12 09:42:00,Naver News,http://www.doctorstimes.com/news/articleView.html?idxno=236793,"임수 분당서울대병원 내분비대사내과 교수팀, ‘차세대 비만약’ 개발 전략 제시","위고비, 마운자로 등으로 대표되는 GLP-1 기반 비만 치료제가 식욕 및 에너지 소비와 연관된 장·췌장 호르몬 신호를 복합적으로 조절하는 약물로 빠르게 진화하고 있다는 분석이 나왔다. 이에 따라 평균 체중 감소율이 15% 안팎인 현행 치료제를 넘어 20%를 넘어서는 차세대 약제가 등장할 가능성도 점쳐진다.임수 분당서울대병원 내분비대사내과 교수 연구팀과 손장원 가톨릭의대 부천성모병원 교수 연구팀은 세계적 비만·당뇨 전문가인 마이클 넉(Michael A. Nauck) 독일 보훔대학 박사와 함께 국제 학술지 ‘Endocrine Revie.",local,4,합병,,
2026-02-12,BD,2026-02-12 09:52:00,Naver News,https://www.ebn.co.kr/news/articleView.html?idxno=1699572,"hy, ‘이뮤노바이옴’과 전략적 사업제휴…맞춤형 장 건강 솔루션 개발 - 이비엔(EBN)뉴스센터",hy가 ‘이뮤노바이옴’과 전략적 사업제휴를 체결했다고 12일 밝혔다.hy는 협업을 계기로 자사 프로바이오틱스 개발 역량과 이뮤노바이옴의 데이터 분석기술을 결합해.,local,4,제휴,,
2026-02-12,BD,2026-02-12 08:02:00,Naver News,https://www.hani.co.kr/arti/hanihealth/pharm/1244631.html,“제네릭 깎아서 신약 만든다?…번지수 틀린 진단입니다” [건강한겨레],보건복지부가 추진 중인 약가 제도 개편안을 둘러싼 논란이 가라앉지 않고 있다. 정부는 제네릭(복제약) 의약품의 약가를 일괄 인하해 건강보험 재정을 절감하고 이 재원을 신약 개발 인센티브로 돌리겠다는 구상이다. 제네릭 위주의 제약 산업 구조를 바꾸고 글로벌 경쟁력을 갖춘.,local,4,제네릭,,
2026-02-12,BD,2026-02-12 09:52:00,Naver News,https://biz.heraldcorp.com/article/10675244?ref=naver,"굿닥, 설 연휴 의료 공백 메운다…비대면진료·병원정보 제공",병원 접수·예약 플랫폼 굿닥이 다가오는 설 연휴 기간 의료 공백을 최소화하기 위해 비대면진료 서비스를 전면 운영하고 전국 병의원 운영 정보.,local,4,제휴,,
2026-02-12,BD,2026-02-12 08:20:00,Naver News,http://www.hansbiz.co.kr/news/articleView.html?idxno=816668,[ 기고 ]  안동에 국립의대라는 단비로 응답하라,"이른 아침, 안동역과 안동터미널은 수도권으로 향하는 승객들로 붐빈다. 그 행렬의 상당수는 치료와 진료를 위해 길을 나서는 시민들이다.이는 단순한 이동의 풍경이 아니다. 인구는 물론 의료·교육 등 정주 여건 전반에서 수도권 일극 체제가 만들어낸 가슴 아픈 불균형의 단면이다.안동을 비롯한 경상북도 북부지역은 초고령화로 의료 수요가 급증하고 있다. 그러나 전문의 이탈과 인프라 부족으로 중증환자와 치료가능환자 사망률은 전국 최고 수준에 이르고 있다.이곳에서 수도권으로 향하는 버스와 열차는 더 이상 교통수단.",local,4,백신,,
2026-02-12,BD,2026-02-12 06:56:00,Naver News,http://www.newsmp.com/news/articleView.html?idxno=251614,"FDA, 모더나 mRNA 독감 백신 허가 심사 거부",미국 식품의약국(FDA)이 모더나의 mRNA(메신저리보핵산) 인플루엔자(독감) 백신 승인 심사를 거부했다.모더나는 FDA 산하 생물의약품 평가연구센터(CBER)로부터 인플루엔자 백신 후보물질 mRNA-1010에 대한 생물학적제제 허가신청서(BLA) 심사를 개시하지 않겠다는 통보와 함께 접수 거부 서한을 수령했다고 10일 밝혔다.해당 신청서의 신속한 심사를 위해 모더나는 우선 심사 바우처를 사용한 상태였다.CBER은 서한에서 표준 용량 계절성 인플루엔자 백신을 비교군으로 선택한 점을 허가 신청서 심사를 거부한 유일한 사유.,local,4,생물학적제제,,
2026-02-12,BD,2026-02-11 09:46:00,Naver News,https://www.medicaltimes.com/Main/News/NewsView.html?ID=1167277&ref=naverpc,"[메디칼타임즈] 빅파마 등 30년 경력…바이오플러스, 명상운 부사장 선임","국내 바이오·의료기기 기업 바이오플러스가 글로벌 제약·바이오 산업에서 30년 가까운 경력을 쌓아온 명상운 부사장(Gus Myung)을 영입하며, 바이오의약품 공정 및 품질 경쟁력 강화에 나선다.명 부사장은 바이오플러스 바이오사업지원단 소속으로, 향후 바이오사업의 해외영업지원 및 RA/QA 총괄을 맡아, 바이오의약품 사업의 핵심 역할을 수행할 예정이다.명 부사장은 미국 노스캐롤라이나주립대학교(North Carolina State University)에서 생화학 학사 및 단백질 화학 기반 식품과학 석사 학위를 취득했다. 이후 화이자(Pfizer)·와이어스(Wyeth)·GSK·노바티스(Novartis) 등 글로벌 제약사와 삼성바이오로직스, 후지필름 디오신스 바이오테크놀로지스(FUJIFILM Diosynth Biotechnologies) 등 글로벌 CDMO 기업에서 핵심 직책을 역임했다.특히 삼성바이오로직스에서는 MSAT(Manufacturing Science and Technology) 분석팀 디렉터로 재직하며 단백질 의약품 위탁생산(CDMO) 공정과 분석 조직을 총괄했다. 다수의 전문 인력으로 구성된 조직을 이끌며 공정 분석, 분석법 개발 및 기술이전, 밸리데이션을 주도했고, FDA·EMA 등 글로벌 규제기관 대응에도 핵심적인 역할을 수행했다.",local,4,화이자,,
2026-02-12,BD,2026-02-11 09:30:00,Naver News,https://news.bizwatch.co.kr/article/healthcare/2026/02/10/0025,"'플랫폼·후기라운드' 돈 몰린다…AI 신약 '갤럭스', 420억 유치","인공지능(AI) 신약 설계 전문 기업 갤럭스가 420억원 규모의 시리즈B 투자를 유치에 성공했다. 최근 퍼스트바이오테라퓨틱스, 엘리시젠 등 바이오벤처들의 대규모 펀딩 성공 사례가 잇따르면서 기술력으로 성과가 기...",local,4,베링거인겔하임,,
2026-02-12,BD,2026-02-12 08:00:00,Naver News,https://tjmbc.co.kr/NewsArticle/824810,항생제·백신 없이 면역⋯차세대 감염 예방 전략 개발,"한국 생명공학연구원이, 항생제나백신 없이도 감염 전에 신체의 면역을 미리 깨워 병원균을 방어하는 예방 전략을 개발했습니다.연구진은 의약품 첨가물로만 사용되던 'DDM'이선천 면역 세포를 활성화한다는 사실을 ...",local,4,백신,,
2026-02-12,BD,2026-02-12 09:10:00,Naver News,http://www.press9.kr/news/articleView.html?idxno=72321,"유한양행, 2026년 레이저티닙 임상 성과가 관건-SK증권","유한양행이 2025년 4분기 연구개발(R&D) 비용 증가와 일부 마일스톤 수익 이연 영향으로 시장 기대치를 밑도는 실적을 기록했다. 다만 레이저티닙과 아미반타맙 병용요법의 임상적 이득 입증 여부에 따라 2026년 이후 실적 반등 가능성은 여전히 유효하다는 평가다.SK증권에 따르면 유한양행의 2025년 4분기 연결 매출은 5,461억 원으로 전년 동기 대비 10.1% 증가했지만, 직전 분기 대비로는 4.2% 감소했다. 영업이익은 26억 원으로 흑자 전환에 성공했으나, 시장 컨센서스에는 크게 못 미쳤다.",local,4,라이선스,,
2026-02-12,BD,2026-02-11 17:16:00,Naver News,https://www.insight.co.kr/news/542794,"“기술 산업에서 캐시카우로”... K-바이오 기업, 수익 본격화",국내 바이오 기업들이 연구개발 중심 적자 구조에서 벗어나 기술수출과 신약 매출을 통한 본격적인 수익 창출 단계로 진입했습니다.,local,4,GSK,,
2026-02-12,BD,2026-02-10 16:28:00,Naver News,https://www.mt.co.kr/thebio/2026/02/11/2026021016140932251,'체내 CAR-T'에 쏠리는 빅파마 시선…'K-바이오' 포지션은 - 머니투데이,"일라이 릴리는 9일(현지시간) 오르나 테라퓨틱스를 최대 24억달러에 인수하며 생체 내 CAR-T 치료제 개발에 투자했습니다. 오르나는 원형 RNA 기술과 지질나노입자 전달 플랫폼을 결합한 생체 내 CAR-T 치료제를 개발 중이며, 선도 프로그램 'ORN-252'는 임상시험 준비가 완료되었습니다.",local,4,BMS,,
2026-02-12,Product Approval,2026-02-12 09:45:00,Naver News,https://health.chosun.com/site/data/html_dir/2026/02/11/2026021103106.html,"""소리 없이 찾아오는 신장병, 환자마다 해법 달라… 맞춤형 치료가 핵심""","건국대병원 '희귀난치질환 희망 동행' 캠페인 만성 신장병, 증상 없어도 치료해야 방치 時 말기 신부전으로 진행할 수도 투석 대상 환자, '혈액 여과' 방식 고려 일반 투석이 못 거르는 노폐물도 제거 20대 남성 김모씨는 사구체신염이 있었으나 별다른 이상을 느끼지 못해 병원에 잘 다니지 않았다. 이후 자신의 병이 만성 신장병으로 악화한 것을 알게 됐으나, 이미 말기였기 때문에 투석을 시작해야만 했다. 김씨처럼 만성 신장병이 말기 신부전으로 진행돼 투석이 필요한 경우 중증난치성 질환으로 분류된다.",local,3,용량,,
